Query,Score,Suggestion
روش انتقال شارژ همراه اول,,1
خرید مودم ایرانسل,,1
تاریخ امروز,,3
بهترین فیلتر شکن برای اینترنت همراه اول,,1
فیلتر شکن همراه اول با لینک مستقیم,,1
آهنگ پیشواز همراه اول هایده,,1
کد فهمیدن شماره همراه اول,,1
صورت حساب همراه اول,,1
دایورت کردن خط همراه اول,,1
خرید شارژ اینترنت همراه اول,,1
روش شارژ همراه اول,,1
فیلتر شکن همراه اول,,1
فعال سازی پشت خطی همراه اول,,1
فیلتر شکن قوی,,1
فیلترشکن همراه اول,,1
ترابرد به همراه اول,,1
کد دستوری مانده اینترنت همراه اول,,1
قطع تعرفه آزاد همراه اول,,2
خرید شارژ مستقیم همراه اول,,1
دریافت تنظیمات اینترنت همراه اول,,1
طریقه شارژ همراه اول,,1
فعال کردن پشت خطی همراه اول,,1
فیلتر شکن,,1
دیجی کالا,,3
فیلترشکن قوی برای همراه اول,,1
کد همراه اول,,1
پیشواز همراه اول,,1
اینترنت همراه اول,,1
شارژ همراه اول,,1
آهنگ,,1
کد پیشواز همراه اول,,1
آهنگ پیشواز همراه اول,,1
آهنگ پیشواز,,1
بسته همراه اول,,1
ایرانسل,,1
همراه اول سیم کارت,,1
کد آهنگ پیشواز,,1
کد آهنگ پیشواز همراه اول,,1
بسته اینترنت همراه اول,,1
کد اینترنت همراه اول,,1
کد شارژ همراه اول,,1
قبض همراه اول,,2
همراه اول من,,1
همراه من,,1
همراه من همراه اول,,1
پرداخت همراه اول,,1
مکالمه همراه اول,,1
خرید اینترنت همراه اول,,1
کد تقویت آنتن موبایل ایرانسل,,1
مزایده ایرانسل,,
خرید بسته اینترنت ایرانسل برای دیگران,,1
کد غیر فعال سازی اینترنت آزاد ایرانسل,,2
ترابرد ایرانسل به رایتل,,1
ابلاغیه,,2
قیمت سیمکارت ایرانسل,,1
خرید بسته اینترنتی ایرانسل,,1
ایرانسل من فارسی,,1
چگونه بفهمیم چقدر حجم اینترنت ایرانسل داریم,,1
لغو پیامک های تبلیغاتی ایرانسل,,2
پشتیبانی مودم ایرانسل,,1
کد پیشواز ایرانسل عاشقانه,,1
رایتل من,,1
مای ایرانسل وب,,1
خرید بسته مودم ایرانسل,,1
لنز ایرانسل,,1
خرید سیم کارت همراه اول,,1
کد لغو پیامک تبلیغاتی ایرانسل,,2
قبض ایرانسل دائمی,,2
ایران خودرو,,3
ترابرد به ایرانسل,,1
کد اهنگ پیشواز ایرانسل شیک,,1
کد خرید شارژ ایرانسل,,1
خرید سیم کارت ایرانسل رایگان,,1
اینترنت ایرانسل,,1
ایرانسل من,,1
شارژ ایرانسل,,1
پیشواز ایرانسل,,1
بسته ایرانسل,,1
همراه اول,,1
سیم کارت ایرانسل,,1
کد اینترنت ایرانسل,,1
کد پیشواز ایرانسل,,1
آهنگ پیشواز ایرانسل,,1
بسته اینترنت ایرانسل,,1
شماره ایرانسل,,1
کد شارژ ایرانسل,,1
خرید اینترنت ایرانسل,,1
مودم ایرانسل,,1
خرید بسته ایرانسل,,1
کد آهنگ پیشواز ایرانسل,,1
قبض ایرانسل,,2
ایرانسل من دانلود,,1
انتقال شارژ ایرانسل,,1
خرید بسته اینترنت ایرانسل,,1
خرید شارژ ایرانسل,,1
کارآموزی همراه اول,,1
ترابرد همراه اول به رایتل,,1
کد پیشواز همراه اول دل از من دلبری از تو,,1
پرینت خط همراه اول,,1
کد انتقال شارژ همراه اول اعتباری به اعتباری,,1
کد لغو تعرفه آزاد همراه اول,,2
رمز شارژ اضطراری همراه اول,,1
1000 تومان شارژ رایگان همراه اول,,1
volte همراه اول,,1
پرداخت بدهی همراه اول,,1
سوزاندن سیم کارت همراه اول,,
پیشواز,,1
کد پیشواز,,1
سیم کارت همراه اول,,1
شماره همراه اول,,1
نحوه لغو آهنگ پیشواز ایرانسل,,2
فیلیمو رایگان ایرانسل,,1
فیلیمو ایرانسل,,1
فیلیمو,,1
کد لغو تمدید خودکار اینترنت ایرانسل,,2
فیلترشکن قوی برای ایرانسل,,1
چرا اینترنت ایرانسل کار نمیکنه,,2
بهترین فیلترشکن برای ایرانسل,,1
فیلتر شکن قوی ایرانسل,,1
فیلترشکن ایرانسل,,1
کد رفع مشکل اینترنت ایرانسل,,2
فیلتر شکن ایرانسل,,1
چگونه اهنگ پیشواز ایرانسل را برداریم,,2
تنظیمات اینترنت ایرانسل شیائومی,,1
فعال کردن پشت خطی ایرانسل,,1
فیلتر شکن برای ایرانسل,,1
امروز چندمه,,3
خرید شارژ ایرانسل مستقیم,,1
کد ایرانسل,,1
دانلود ایرانسل من,,1
رومینگ ایرانسل,,1
بسته اربعین همراه اول,,1
سامانه سماح,,3
خرید بسته اینترنت رومینگ همراه اول در عراق,,1
تغییر مالکیت سیم کارت همراه اول غیر حضوری,,1
سماح,,3
کد دستوری رومینگ همراه اول,,1
رومینگ همراه اول در عراق,,1
فعال سازی رومینگ همراه اول در عراق,,1
کد رومینگ همراه اول,,1
هزینه رومینگ همراه اول در عراق,,1
فعالسازی رومینگ همراه اول,,1
کد فعال سازی رومینگ همراه اول,,1
اینترنت رومینگ همراه اول,,1
بسته رومینگ همراه اول,,1
خرید بسته رومینگ همراه اول,,1
رومینگ همراه اول,,1
فعال کردن رومینگ همراه اول,,1
فعال سازی رومینگ همراه اول در خارج از کشور,,1
کد همراه اول برای موجودی اینترنت,,1
کدانتقال شارژ همراه اول به همراه اول,,1
کد آهنگ پیشواز همراه اول غمگین ترکی با صدای زن,,1
پرطرفدارترین آوای انتظار همراه اول,,1
سایت سنجش,,3
شارژ همراه اول کد,,1
بسته اینترنت اربعین ایرانسل,,1
فعالسازی رومینگ ایرانسل,,1
اینترنت مرزی ایرانسل,,1
خرید بسته اینترنت رومینگ ایرانسل در عراق,,1
رومینگ ایرانسل در عراق,,1
بسته های رومینگ ایرانسل,,1
ورزش3,,3
هزینه رومینگ ایرانسل در عراق,,1
فعال سازی رومینگ ایرانسل,,1
اینترنت رومینگ ایرانسل,,1
بسته رومینگ ایرانسل,,1
خرید بسته رومینگ ایرانسل,,1
انتقال شارژ ایرانسل به ایرانسل بدون رمز,,1
کد فعال سازی رومینگ ایرانسل,,1
فعال کردن رومینگ ایرانسل,,1
بسته مکالمه ایرانسل ماهانه,,1
روبیکا وب,,1
کد مکالمه رایگان ایرانسل ماهانه,,1
مناطق تحت پوشش 5g ایرانسل,,1
irancell man,,1
ایرانسل اینترنت,,1
شارژ ایرانسل کد,,1
نت ایرانسل,,1
کارنامه همراهی همراه اول,,1
اهنگ پیشواز همراه اول محرم,,1
پیشواز محرم همراه اول,,1
پیشواز محرمی همراه اول,,1
کد پیشواز محرم همراه اول,,1
اهنگ پیشواز محرمی همراه اول,,1
کد آهنگ پیشواز محرم همراه اول,,1
کد پیشواز نوحه ترکی همراه اول سید طالع باکویی,,1
کد پیشواز محرمی همراه اول,,1
کد پیشواز نوحه همراه اول,,1
کد پیشواز نوحه ترکی همراه اول,,1
نوحه پیشواز همراه اول,,1
پیشواز نوحه ترکی همراه اول,,1
کد پیشواز محمود کریمی همراه اول,,1
کد پیشواز مداحی همراه اول,,1
کد پیشواز نوحه ترکی سوزناک,,1
پیشواز مداحی همراه اول,,1
آموزشیار,,3
کد تغییر آهنگ پیشواز همراه اول,,1
آهنگ پیشواز مداحی همراه اول,,1
بهترین فیلترشکن برای همراه اول,,1
کد آهنگ پیشواز همراه اول مذهبی امام زمان,,1
کد لغو انتقال تماس همراه اول,,2
رایگان همراه اول,,1
هدیه ایرانسل برای عید غدیر,,1
پیشواز محرمی ایرانسل,,1
پیشواز محرم ایرانسل,,1
اهنگ پیشواز محرم ایرانسل,,1
نسخه وب ایرانسل من ایفون,,1
دانلود نسخه وب ایرانسل من,,1
پرسرعت ترین vpn ایرانسل,,1
irancell.ir,,1
ایرانسل من تحت وب,,1
my irancell.ir,,1
ورود به سایت ایرانسل من,,1
myirancell,,1
لغو آهنگ پیشواز ایرانسل 7575,,2
کداستعلام مانده اینترنت ایرانسل,,1
خط ایرانسل,,1
استعلام ایرانسل,,1
کد استعلام موجودی همراه اول,,1
کد مکالمه رایگان ماهانه همراه اول اعتباری,,1
720 دقیقه مکالمه همراه اول,,1
نت شبانه همراه اول,,1
کد اینترنت شبانه همراه اول,,1
فعال كردن پشت خط همراه اول,,1
اهنگ پیشواز صبر کن الان جواب میده همراه اول,,1
قیمت سیمکارت همراه اول,,1
فیلترشکن مخصوص همراه اول,,1
قطع پیامک تبلیغاتی همراه اول,,2
رایگان کردن همراه اول,,1
کد بهترین بسته اینترنت همراه اول یک ماهه,,1
کد مکالمه رایگان همراه اول,,1
کد مکالمه رایگان ماهانه همراه اول,,1
کد بسته مکالمه همراه اول اعتباری,,1
پیش شماره های همراه اول,,1
مکالمه همراهی همراه اول,,1
بسته اینترنت همراه اول یک ماهه,,1
کد اینترنت نامحدود همراه اول,,1
کد مکالمه همراه اول,,1
خريد اينترنت همراه اول,,1
مکالمه رایگان همراه اول,,1
اینترنت شبانه همراه اول,,1
همراه اول اینترنت,,1
خرید سیم کارت ایرانسل تحویل درب منزل,,1
کد 72 گیگ اینترنت رایگان ایرانسل,,1
لغو تمدید خودکار بسته اینترنت ایرانسل,,2
کد لغو تبلیغات ایرانسل,,2
کد فعال سازی 14 گیگ اینترنت رایگان ایرانسل,,1
persian gulf,,3
حذف پیشواز ایرانسل بدون کد,,2
اینترنت شبانه ایرانسل,,1
کد اینترنت نامحدود ایرانسل,,1
ترجمه گوگل,,3
اینترنت نامحدود همراه اول,,1
هدیه تولد ایرانسل,,1
پیش شماره های ایرانسل,,1
لغو پیامک تبلیغاتی ایرانسل,,2
كد وارد كردن رمز شارژ ایرانسل,,1
کد نت رایگان ایرانسل,,1
قطع پیامک تبلیغاتی ایرانسل,,2
کد پیشواز همراه اول راغب خستم از دنیا,,1
تماس تصویری همراه اول,,1
کد لغو دایورت تماس همراه اول,,
سامانه یکپارچه خودرو,,3
کد پیشواز همراه اول مرتضی جعفرزاده دل شکسته که دل نمیشه,,1
مترجم گوگل,,3
اهنگ پیشواز همراه اول عشقم,,1
کد تماس از دست رفته همراه اول,,1
کد شارژ همراه اول از طریق موبایل,,1
کد خرید بسته اینترنت همراه اول دائمی,,1
پرسرعت ترین vpn همراه اول,,1
فعال سازی رومینگ همراه اول,,1
آهنگ پیشواز مادر همراه اول,,1
ابلاغیه الکترونیکی,,2
کد انتقال شارژ همراه اول به همراه اول بیشتر از 1000 تومان,,1
لغو آهنگ پیشواز همراه اول,,2
کد پیشواز همراه اول دلم گرفته ای خدا,,1
کد لغو آهنگ پیشواز همراه اول,,2
خرید همراه اول,,1
کد آهنگ پیشواز همراه,,1
"mobilecount.cra.ir جزئیات بیشتر نحوه استعلام تعداد سیم کارت ایرانسل ،همراه اول و رایتل",,1
کد فعال سازی پشت خطی ایرانسل,,1
بروز رسانی ایرانسل من,,1
کد انتقال شارژ از ایرانسل به همراه اول,,1
استعلام موجودی ایرانسل,,1
وارد كردن رمز شارژ ایرانسل,,1
۰۹۹۱ ایرانسل یا همراه اول,,
کد انتقال شارژ ایرانسل به ایرانسل بیشتر از 1000 تومان,,1
حذف پیام های تبلیغاتی ایرانسل,,2
تماس با اپراتور ایرانسل,,2
بام,,3
کد حذف تبلیغات ایرانسل,,2
رفع مسدودی سیم کارت ایرانسل,,1
خرید مودم ایرانسل از نمایندگی,,1
کد بسته های اینترنت ایرانسل ماهانه,,1
حذف تبلیغات ایرانسل,,2
کد لغو دایورت ایرانسل,,
خرید سیم کارت ایرانسل با شماره دلخواه 0935,,1
قطع تبلیغات ایرانسل,,2
غیر فعال سازی آهنگ پیشواز ایرانسل,,2
چگونه پیشواز ایرانسل را حذف کنیم,,2
کد حذف اهنگ پیشواز ایرانسل,,2
دانلود,,1
mobilecount.cra.ir,,1
سوابق بیمه تامین اجتماعی,,3
کد انتقال شارژ همراه اول به همراه اول بیشتر از 10000 تومان,,1
دانلود فیلتر شکن برای همراه اول,,1
بهترین فیلتر شکن برای همراه اول,,1
فیلتر شکن قوی برای همراه اول,,1
دانلود فیلتر شکن همراه اول,,1
فیلتر شکن همراه اول قوی,,1
کدهای همراه اول دائمی,,1
فیلتر شکن برای همراه اول,,1
فیلترشکن قوی,,1
vpn برای همراه اول,,1
vpn,,1
vpn همراه اول,,1
آهنگ پیشواز همراه اول خواننده های قدیمی شاد,,1
نحوه خرید بسته اینترنت همراه اول,,1
پروکسی همراه اول تلگرام,,1
وام ازدواج,,3
دیوار تهران,,3
سیم کارت رایگان ایرانسل با کارت ملی,,1
خرید شارژ همراه اول,,1
مناطق تحت پوشش td lte ایرانسل,,1
رمز انتقال شارژ ایرانسل,,1
فیلتر شکن ایرانسل قوی,,1
شهر خبر,,3
لغو اهنگ پیشواز ایرانسل,,2
دانلود فیلتر شکن برای ایرانسل,,1
مبین نت,,1
تلوبیون,,3
خرید سیمکارت ایرانسل,,1
پروکسی تلگرام ایرانسل,,1
تنظیمات ایرانسل,,1
عیدی همراه اول ۱۴۰۲,,1
کد عیدی همراه اول ۱۴۰۲,,1
کد عیدانه همراه اول,,1
هدیه نوروزی همراه اول,,1
کد عیدی همراه اول 1402,,1
کد فعالسازی عیدانه همراه اول,,1
کد عیدانه همراه اول ۱۴۰۲,,1
هدیه نوروزی همراه اول ۱۴۰۲,,1
عیدی همراه اول نوروز ۱۴۰۲,,1
هدیه همراه اول برای نوروز ۱۴۰۲,,1
کد عیدی ایرانسل ۱۴۰۲,,1
کد فعالسازی عیدی همراه اول ۱۴۰۲,,1
کد 2 گیگ اینترنت رایگان همراه اول 1401,,1
کد عیدی همراه اول,,1
طرح عیدانه همراه اول,,1
کد دریافت عیدی همراه اول ۱۴۰۲,,1
عیدانه همراه اول,,1
عیدی ایرانسل,,1
عیدی همراه اول,,1
کد عیدی همراه اول نوروز 1402,,1
عیدی همراه اول 1402,,1
بسته عیدانه همراه اول,,1
اینترنت عیدی همراه اول,,1
عیدی همراه اول برای نوروز 1402,,1
عیدانه همراه اول 1402,,1
کد,,3
عیدانه ایرانسل,,1
عیدی ایرانسل 1402,,1
هدیه نوروزی ایرانسل,,1
عیدی ایرانسل ۱۴۰۲,,1
کد عیدی ایرانسل,,1
عیدانه ایرانسل ۱۴۰۲,,1
بروزرسانی ایرانسل من,,1
کد نشان دهنده شماره سیم کارت ایرانسل,,1
کد دوشنبه سوری ایرانسل,,1
اینترنت نامحدود ایرانسل 1 تا 11,,1
چگونه شماره ایرانسل خود را بفهمیم,,1
ایرانسل من نسخه قدیمی,,1
کد قطع تبلیغات ایرانسل,,2
روش انتقال شارژ ایرانسل,,1
دیجی موویز,,3
سوپر اپلیکیشن ایرانسل من,,1
برنامه ایرانسل,,1
اینترنت رایگان ایرانسل,,1
اینترنت رایگان همراه اول دهه فجر ۱۴۰۱,,1
کد آهنگ پیشواز همراه اول و عاشقانه,,1
کد فعالسازی پشت خطی همراه اول,,1
چگونه پشت خطی همراه اول را فعال کنیم,,1
مشاهده صورتحساب همراه اول,,2
ارتباط با همراه اول,,
حذف تبلیغات همراه اول,,2
لغو تعرفه آزاد همراه اول,,2
کد حذف تبلیغات همراه اول,,2
کد موجودی اینترنت همراه اول,,1
موجودی اینترنت همراه اول,,1
کد وارد کردن شارژ همراه اول,,1
قیمت دلار,,3
تماس بان همراه اول,,2
خرید بسته اینترنت همراه اول برای دیگران,,1
شماره پشتیبانی همراه اول,,1
باشگاه فیروزه ای همراه اول,,1
کد آهنگ همراه اول,,1
اینترنت رایگان ایرانسل دهه فجر,,1
هدیه ایرانسل برای روز پدر,,1
اینترنت دهه فجر ایرانسل,,1
هدیه روز پدر ایرانسل,,1
نسخه قدیمی ایرانسل من,,1
دانلود ایرانسل من قدیمی,,1
ایرانسل من قدیمی,,1
دانلود ایرانسل من 1401,,1
نحوه شارژ ایرانسل با رمز,,1
دانلود اپلیکیشن ایرانسل من,,1
دانلود ایرانسل من نسخه جدید از بازار,,1
اپلیکیشن ایرانسل من,,1
نسخه جدید ایرانسل من,,1
نسخه وب ایرانسل من,,1
ایرانسل من جدید,,1
دانلود ایرانسل من با لینک مستقیم,,1
دانلود ایرانسل من نسخه جدید,,1
ایرانسل من دانلود مستقیم,,1
دانلود ایرانسل من با لینک مستقیم ios,,1
اینترنت,,1
فعال كردن پيامك تماس از دست رفته همراه اول,,1
سیدا,,3
آهنگ پیشواز مادر راغب همراه اول,,1
دايورت كردن خط همراه اول,,1
اطلاع از بسته اینترنت همراه اول,,1
آپارات,,3
8 گیگ اینترنت رایگان همراه اول,,1
کد باقیمانده اینترنت همراه اول,,1
کد قطع تعرفه آزاد همراه اول,,2
کدهای همراه اول اعتباری,,1
انارستان همراه اول,,1
کد شارژ اضطراری همراه اول رایگان,,1
کد خط به خط همراه اول,,1
کد استعلام شارژ همراه اول,,1
خرید مودم همراه اول,,1
کد درخواست شارژ همراه اول,,1
سیم کارت,,1
اینترنت همراه اول کد,,1
فیلیمو ایرانسل رایگان,,1
هدیه روز مادر ایرانسل,,1
ایرانسل من برای ایفون نسخه وب,,1
mobilecount,,1
vpn قوی برای ایرانسل,,1
بهترین فیلتر شکن برای ایرانسل,,1
کد تعرفه آزاد ایرانسل,,1
vpn برای ایرانسل,,1
نمایندگی ایرانسل در تهران,,1
استعلام سیم کارت ایرانسل با کد ملی,,1
تست سرعت اینترنت,,1
کد قطع تعرفه آزاد ایرانسل,,2
فیلتر شکن قوی برای ایرانسل,,1
ایرانسل شارژ,,1
هدیه همراه اول برای شب یلدا ۱۴۰۱,,1
شارژ رایگان 10000 تومانی همراه اول,,1
اینترنت شب یلدا همراه اول,,1
کد لغو هدایت تماس همراه اول,,2
هدیه همراه اول برای زلزله,,1
فروشگاه انلاین همراه اول,,1
رمز مکالمه همراه اول,,1
چگونه اینترنت رایگان بگیریم همراه اول,,1
بسته ترکیبی همراه اول,,1
کد فعال سازی مکالمه رایگان همراه اول,,1
خدمات مشترکین همراه اول,,1
سایت همراه اول خرید سیم کارت,,1
خرید نت همراه اول,,1
بازار,,3
سهام همراه اول,,1
کد دوشنبه سوری همراه اول,,1
هدیه ایرانسل شب یلدا,,1
لغو پیامک تبلیغاتی همراه اول,,2
چجوری اهنگ پیشواز ایرانسل حذف کنیم,,2
لیست شماره های ایرانسل من,,1
کد آهنگ پیشواز ایرانسل غمگین 96,,1
کد بسته های اینترنت ایرانسل ماهانه رایگان,,1
سهام عدالت,,3
سرویس میزبان پیامک ایرانسل,,1
برنامه ایرانسل من برای ایفون,,1
اینترنت ثابت ایرانسل چیست,,1
کد فهمیدن شماره ایرانسل,,1
فعال سازی پشت خطی ایرانسل,,1
سایپا,,3
دوشنبه سوری ایرانسل,,1
فیلترشکن برای ایرانسل,,1
هدیه همراه اول برای جام جهانی,,1
سه گیگ اینترنت رایگان همراه اول,,1
0993 همراه اول است یا ایرانسل,,
آهنگ پیشواز همراه اول هایده ساقی,,1
اینترنت هدیه همراه اول,,1
کد اینترنت رایگان همراه اول واقعی۱۴۰۱,,1
ایرانخودرو,,3
سایت ایران خودرو,,3
پرداخت قبض همراه اول با موبایل,,1
کد ارسال شارژ همراه اول,,1
کد پیشواز همراه اول لاتی,,1
هدیه همراه اول,,1
قیمت گذاری سیم کارت همراه اول,,1
کد اهنگ پیشواز همراه اول راغب,,1
کد اینترنت رایگان همراه اول,,1
ثبت نام ایران خودرو,,3
اینترنت رایگان ایرانسل برای جام جهانی,,1
نتایج قرعه کشی ایران خودرو,,3
شماره ایرانسل من چند است,,1
هدیه ایرانسل برای برد ایران,,1
نحوه استعلام اینترنت ایرانسل,,1
خدمات مشترکین ایرانسل,,1
اینترنت هدیه ایرانسل,,1
چگونه شارژ ایرانسل را وارد کنیم,,1
کد وارد کردن شارژ ایرانسل,,1
کد دستوری خرید اینترنت ایرانسل,,1
مایکت,,1
افزایش سرعت اینترنت ایرانسل,,1
خرید اینترنت ایرانسل برای دیگران,,1
خرید سیمکارت همراه اول,,1
تنظیمات اینترنت همراه اول در ایفون,,1
آهنگ پیشواز رایگان همراه اول ۱۴۰۰,,1
آهنگ پیشواز دلخواه همراه اول پخش انلاین,,1
کد شارژ اضطراری همراه اول ۶۰۰ تومان,,1
کد اهنگ پیشواز همراه اول مهراب عاشق,,1
کد درخواست تماس همراه اول,,1
کد پیشواز همراه اول غمگین دل شکسته,,1
روبیکا,,1
کد پشت خطی همراه اول,,1
درخواست تماس همراه اول,,1
قیمت طلا امروز,,3
دانلود فیلتر شکن قوی,,1
اهنگ پیشواز محسن لرستانی,,1
پیشواز همراه اول محسن لرستانی,,1
vpn free,,1
پشت خطی همراه اول,,1
آهنگ پیشواز همراه اول محسن لرستانی,,1
کد آهنگ پیشواز همراه اول شاد,,1
همراه اول شارژ,,1
8 گیگ اینترنت رایگان ایرانسل,,1
فیلتر شکن برای پابجی ایرانسل,,1
وی پی ان برای ایرانسل,,1
کد شنود مکالمات ایرانسل,,2
دریافت آنلاین تنظیمات اینترنت ایرانسل,,1
کد شارژ اضطراری ایرانسل ۶۰۰ تومان,,1
کد پشت خطی ایرانسل,,1
کد پیشواز ایرانسل لاتی,,1
پرداخت قبض همراه اول,,1
فروشگاه اینترنتی ایرانسل,,1
قیمت طلا,,3
کد بسته پیامک ایرانسل,,1
استعلام مانده اینترنت ایرانسل,,1
۱۹۲.۱۶۸.۱.۱,,3
بسته ایرانسل اینترنت,,1
عدم ارسال پیامک همراه اول,,2
چرا پیام ارسال نمیشه همراه اول,,2
فیلترشکن برای همراه اول,,1
اینترنت کی وصل میشه,,2
علت ارسال نشدن پیامک همراه اول,,2
چرا پیامک ارسال نمیشود همراه اول,,2
امین تارخ,,3
خرید 0لنا97خلحهچتاد زوپک87,,
اینترنت رایگان اربعین همراه اول,,1
ارسال نشدن پیامک همراه اول,,2
شماره مرکز پیام همراه اول,,1
