Query,Score,Suggestion
تعویض آهنگ پیشواز همراه اول,,1
my.mci.ir همراه اول,,1
انتقال شارژ در همراه اول,,1
اینترنت شبانه همراه اول ازچه ساعتی شروع میشود,,1
ترافیک ملی ایرانسل چیست,,1
انتخاب شماره دلخواه ایرانسل,,1
سامانه سجاد,,3
کد مانده اعتبار اینترنت ایرانسل,,1
انواع مودم ایرانسل,,1
باشگاه خبرنگاران,,3
چگونه اهنگ پیشواز ایرانسل بگذاریم,,1
ترافیک ملی ایرانسل,,1
تبدیل سیم کارت اعتباری به دائمی ایرانسل,,1
کد اهنگ پیشواز ایرانسل بهنام بانی,,1
سیم کارت دائمی ایرانسل,,1
کد آهنگ پیشواز ایرانسل مسعود صادقلو,,1
اینترنت نامحدود ایرانسل رایگان,,1
مای ایرانسل,,1
اینستاگرام,,3
اپلیکیشن ایرانسل,,1
کد پنج دقیقه مکالمه رایگان همراه اول,,1
طرح همراه اول ماه رمضان,,1
کدهای اینترنت همراه اول,,1
بسته های نامحدود همراه اول,,1
یک روز مکالمه رایگان همراه اول,,1
پيشواز همراه اول محمد عليزاده,,1
اینترنت نامحدود رایتل,,1
اطلاع از بسته اینترنتی ایرانسل,,1
حذف اکانت تلگرام,,
آهنگ پیشواز ایرانسل عاشقانه 95,,1
بسته هیبرید ایرانسل,,1
طرح رمضان ایرانسل,,1
دانلود ایرانسل من برای کامپیوتر,,1
سایت ایرانسل من,,1
ای استخدام,,3
کد خرید بسته اینترنتی ایرانسل,,1
دریافت آنلاین تنظیمات اینترنت همراه اول,,1
كد پيشواز همراه اول مسعود صادقلو,,1
رمز اهنگ پیشواز همراه اول,,1
کد پیشواز همراه اول مسعود صادقلو,,1
هزينه تماس بان همراه اول,,2
رویت قبض همراه اول,,2
خرید شارژ همراه اول بانک ملی,,1
خریدبسته اینترنتی همراه اول,,1
خریدشارژ همراه اول,,1
نحوه فعال کردن اینترنت همراه اول,,1
فعال سازی اینترنت همراه اول,,1
طرح تعویض وایمکس ایرانسل,,1
تعویض مودم وایمکس ایرانسل با 4g,,1
طرح تعویض مودم های وایمکس ایرانسل,,1
طرح تعویض مودم ایرانسل,,1
تعویض وایمکس ایرانسل,,1
تعویض مودم وایمکس ایرانسل,,1
مودم وایمکس ایرانسل,,1
کدهای آهنگ پیشواز ایرانسل,,1
حذف آهنگ پیشواز ایرانسل بدون کد,,2
تغییر پیشواز ایرانسل,,1
طریقه شارژ کردن همراه اول,,1
هدیه وای فای همراه اول چیست,,1
وب سایت همراه اول,,1
ریزمکالمات همراه اول,,1
پرداخت قبض تلفن همراه اول,,1
طرح های مکالمه رایگان همراه اول,,1
تابناک,,3
همراه اول صورتحساب,,2
غیر فعال کردن اینترنت همراه اول,,2
امور مشترکین همراه اول,,1
کد انتقال شارژ همراه اول به همراه اول,,1
پرداخت قبض همراه اول بدون شناسه,,1
طرح کنترل مصرف آزاد ایرانسل,,2
انتخاب شماره ایرانسل,,1
تنظیمات مودم 4g ایرانسل,,1
کد لغو تمدید خودکار بسته اینترنت ایرانسل,,2
کد شگفتی های ایرانسل,,1
بسته های اینترنت ایرانسل جدید,,1
درخواست شارژ ایرانسل از دیگران,,1
قطع دائمی پیامک تبلیغاتی همراه اول,,2
قیمت بسته های اینترنت ایرانسل,,1
فارس,,3
حذف پیامهای تبلیغاتی ایرانسل,,2
تعویض سیم کارت ایرانسل به 4g,,1
ویزا کارت,,3
عیدانه همراه اول 96,,1
هزینه سرویس تماس بان همراه اول,,2
خريد شارژ ايرانسل,,1
عیدی همراه اول 96,,1
کد هدیه همراه اول,,1
تماس از دست رفته همراه اول,,
عیدی ایرانسل ۹۶,,1
عیدی ایرانسل به مشترکین,,1
کد شارژ عیدی ایرانسل,,1
کد شارژ عیدانه ایرانسل,,1
شارژ هدیه نوروزی ایرانسل,,1
تا حالا چقدر شارژ ایرانسل مصرف کردم,,1
عیدی ایرانسل 96,,1
شارژ هدیه ایرانسل,,1
کد هدیه نوروزی ایرانسل,,1
استعلام شماره تلفن ایرانسل,,1
سپه,,3
رندترین شماره همراه اول,,1
زومیت,,3
سرویس تماس بان همراه اول,,1
خدمات مبتنی بر محتوا همراه اول,,1
قيمت سيم كارت همراه اول,,1
خدمات مبتنی بر محتوا,,1
هدیه وای فای همراه اول,,1
اطلاع از مانده اینترنت همراه اول,,1
لغو خدمات مبتنی بر محتوا همراه اول,,2
طریقه فعال کردن اینترنت همراه اول,,1
فعال سازی اینترنت همراه اول برای اندروید,,1
فورجی همراه اول,,1
خرید کارت شارژ همراه اول,,1
کد استعلام مانده اینترنت ایرانسل,,1
اهنگ پیشواز ایرانسل غمگین قشنگ,,1
فعال سازی اینترنت 4g ایرانسل,,1
780,,3
برای حذف آهنگ پیشواز ایرانسل,,2
کد باقیمانده اینترنت ایرانسل,,1
کد مانده اینترنت ایرانسل,,1
شماره ایرانسل مال کیه,,1
شارژ مستقیم,,1
سیم کارت یوسیم همراه اول,,1
تعویض سیم کارت همراه اول به 4g,,1
وای فای همراه اول,,1
تعویض سیم کارت همراه اول 4g,,1
دفاتر امور مشترکین همراه اول,,1
فعال سازی سیم کارت اعتباری همراه اول,,1
تنظیمات 4g همراه اول,,1
دفاتر خدمات همراه اول,,1
فعال سازی بسته اینترنت همراه اول,,1
sabt.irancell.ir,,1
خرید شارژ ایرانسل asan-charge.ir,,1
sabt.irancell,,1
تکمیل مشخصات ایرانسل,,1
ورزش,,3
تکمیل ثبت نام ایرانسل,,1
ثبت نام خط ایرانسل,,1
تکمیل ثبت نام سیم کارت ایرانسل,,1
کد پیشواز ایرانسل حامد همایون به چشمات قسم,,1
کد پیشواز ایرانسل حامد همایون چتر خیس,,1
ثبت ایرانسل,,1
کد آهنگ پیشواز ایرانسل حامد همایون,,1
ایرانسل پیشواز,,1
قطع پیامک های تبلیغاتی همراه اول,,2
هواشناسی,,3
استعلام بسته اینترنت همراه اول,,1
آهنگ پیشواز همراه اول حامد همایون,,1
شماره اپراتور همراه اول,,1
حجم باقیمانده اینترنت همراه اول,,1
آدرس خدمات مشترکین ایرانسل تهران,,1
قطع پیامکهای تبلیغاتی ایرانسل,,2
خریدبسته اینترنتی ایرانسل,,1
دفتر ایرانسل تهران,,1
سامانه استعلام سیم کارت ایرانسل,,1
مرکز خدمات ایرانسل,,1
دفتر خدمات ایرانسل,,1
استعلام سیم کارت ایرانسل,,1
گوگل فارسی,,3
نحوه ارسال شارژ ایرانسل,,1
کد عراق,,1
شبهای روشن همراه اول,,1
تنظیمات اینترنت همراه اول 4g,,1
بانک کشاورزی,,3
شاتل,,3
نحوه وارد كردن شارژ همراه اول,,1
قرعه کشی همراه اول,,1
استعلام تعداد سیم کارت همراه اول,,1
دانلود نرم افزار ایرانسل برای اندروید,,1
لغو پیامک های ایرانسل,,2
استعلام خط ایرانسل,,1
تارنمای همراه اول,,1
آدرس دفاتر امور مشترکین همراه اول غرب تهران,,1
سرشماری,,3
کد غیر فعال سازی تبلیغات همراه اول,,2
آوای انتظار محرم همراه اول,,1
نود,,3
امور مشتركين همراه اول,,1
پیشواز همراه اول محرم,,1
پرداخت اینترنتی قبض همراه اول,,1
لغو پیامکهای تبلیغاتی همراه اول,,2
بانک انصار,,3
دانلود نرم افزار مای ایرانسل,,1
تارنمای ایرانسل,,1
صبانت,,3
بانک سامان,,3
کد پیشواز ایرانسل محمود کریمی,,1
خریدشارژ ایرانسل,,1
کد بسته های اینترنت ایرانسل,,1
فعال سازی سیم کارت هدیه ایرانسل,,1
دلیت اکانت تلگرام,,3
خرید شارج ایرانسل,,1
ایرانسل 4g,,1
کد لغو تبلیغات همراه اول,,2
ترابرد همراه اول,,1
ترابرد,,1
طريقه شارژ همراه اول,,1
خريد شارژ همراه اول مستقيم,,1
چگونه بسته اینترنتی همراه اول بخریم,,1
کد پیشواز همراه اول مداحی جواد مقدم,,1
خرید بسته افزایشی وایمکس ایرانسل,,1
کد پیشواز ایرانسل حامد همایون,,1
پیشواز مداحی ایرانسل,,1
اینترنت وای فای ایرانسل,,1
ایرانسل ترابرد,,1
ترابردپذیری ایرانسل,,1
دانلود نرم افزار ایرانسل من,,1
خرید سیم کارت ایرانسل 4g,,1
فعال سازی اینترنت ایرانسل 4g,,1
وایمکس,,1
روزنامه ها,,3
مهسان چت,,3
كد غير فعال كردن تبليغات همراه اول,,2
روزنامه,,3
نحوه شرکت در قرعه کشی همراه اول,,1
شماره تماس همراه اول,,2
اخبار روز,,3
کد باقیمانده شارژ همراه اول,,1
td lte ایرانسل,,1
خريد بسته اينترنت ايرانسل,,1
کد قطع پیامک تبلیغاتی ایرانسل,,2
شماره 7031 ایرانسل,,1
لغو تمامی سرویس های ایرانسل,,2
قطع اس ام اس تبلیغاتی ایرانسل,,2
پارس آنلاین,,3
انتقال وجه بانک ملی,,3
سایت ایرانسل صفحه اصلی,,1
فعال کردن سیم کارت ایرانسل,,1
لغو اس ام اس های تبلیغاتی ایرانسل,,2
وصل کردن اینترنت ایرانسل,,1
مودم 4g ایرانسل,,1
4g ایرانسل,,1
ایرانسل وایمکس,,1
گوشی قسطی همراه اول,,1
فروش گوشی همراه اول,,1
فروش اقساطی موبایل همراه اول,,1
صورتحساب همراه اول دائمی,,2
فروش اقساطی گوشی همراه اول,,1
گوشی شیائومی,,3
فعال كردن يك روز مكالمه رايگان همراه اول,,1
نحوه شارژ اینترنت همراه اول,,1
بانک مهر اقتصاد,,3
کد دستوری شارژ همراه اول,,1
تنظیمات اینترنت همراه اول برای آیفون 6,,1
تنظیمات اینترنت همراه اول 3g,,1
شماره گلچین همراه اول,,1
گوشی همراه اول,,1
اطلاعات مشترکین ایرانسل,,1
ربات اطلاعات ایرانسل,,1
ربات دیتابیس ایرانسل,,1
افشای اطلاعات ایرانسل,,2
ربات هک ایرانسل,,2
ربات تلگرامی ایرانسل,,2
دیتابیس شماره های ایرانسل,,2
مناطق تحت پوشش 4g همراه اول,,1
هک شدن ایرانسل,,2
تعرفه های وایمکس ایرانسل,,1
ربات ایرانسل,,2
ربات تلگرام ایرانسل,,2
اطلاعات ایرانسل,,2
اطلاعات لو رفته ایرانسل,,2
خریدبسته اینترنت ایرانسل,,1
دیتابیس ایرانسل,,2
دانلود دیتابیس ایرانسل,,2
طرح همراه اول در ماه رمضان,,1
اول مارکت همراه اول چیست,,1
کد غیرفعال سازی تبلیغات همراه اول,,2
شارژ همراه اول از طریق موبایل,,1
کد فعال سازی یک روز مکالمه رایگان همراه اول,,1
غير فعال كردن پيامك تبليغاتي همراه اول,,2
اپلیکیشن همراه اول,,1
طرح دقایق زوج ایرانسل,,1
طرح دقایق زوج رایگان ایرانسل,,1
طرح مکالمه رایگان ایرانسل در ماه رمضان,,1
طرح مکالمه رایگان ماهانه ایرانسل,,1
باقی مانده بسته اینترنت ایرانسل,,1
نواحی تحت پوشش 4g ایرانسل,,1
سایت ایرانسل خندوانه,,1
تنظیمات اینترنت ایرانسل برای اندروید,,1
جیمیل,,3
کد تعویض آهنگ پیشواز ایرانسل,,1
کد آهنگ پیشواز ایرانسل محمد علیزاده,,1
قرعه کشی اول مارکت,,1
دانلود اول مارکت همراه اول,,1
کد دستوری انتقال شارژ همراه اول,,1
نحوه خريد بسته اينترنت همراه اول,,1
حذف پیامک تبلیغاتی همراه اول برای همیشه,,2
استخاره,,3
مارکت همراه اول,,1
رمز انتقال اعتبار همراه اول,,1
اول مارکت همراه اول,,1
قطع پیامک تبلیغات همراه اول,,2
یک ماه مکالمه رایگان همراه اول,,1
رمز خرید بسته اینترنتی همراه اول,,1
کد بسته های اینترنتی همراه اول,,1
جی اس ام,,
رند ایرانسل,,1
خرید شماره دلخواه ایرانسل,,1
انتقال شارژ ایرانسل از خطی به خط دیگر,,1
خندوانه,,3
شارژایرانسل,,1
شماره دلخواه ایرانسل,,1
مکالمه نامحدود ایرانسل,,1
قطع پیامکهای تبلیغاتی همراه اول,,2
ایسنا,,3
بانك ملت,,3
حذف پيامك تبليغاتي همراه اول,,2
جمعه های رویایی همراه اول,,1
شارژ مستقيم همراه اول,,1
بانک مسکن,,3
استخدام,,3
دریافت سیم کارت هدیه ایرانسل,,1
ساعات خوش وایمکس ایرانسل,,1
پيدا كردن كد آهنگ پيشواز ايرانسل,,1
عکس های خفن,,3
استعلام سیم کارت,,1
کنترل حساب اینترنتی,,
شارژ ایرانسل بانک ملی,,1
تعویض سیم کارت ایرانسل 4g,,1
کد آهنگ پیشواز ایرانسل میثم ابراهیمی,,1
خرید,,1
طرح بيست همراه اول,,1
عيدانه همراه اول,,1
طرح 20 همراه اول چیست,,1
طرح بیست همراه اول,,1
عیدی همراه اول 95,,1
طرح 20 همراه اول,,1
رومينگ همراه اول,,1
تنظیمات اینترنت همراه اول برای آیفون,,1
عیدی همراه اول به مشترکین,,1
شارژهمراه اول,,1
همراه اول اينترنت,,1
ایرانسل خندوانه,,1
اپلیکیشن خندوانه,,3
لغو طرح تشویقی مکالمه رایگان ایرانسل,,2
دانلود اپلیکیشن خندوانه,,1
عیدی ایرانسل 95,,1
طرح عیدانه ایرانسل,,1
خرید بسته اینترنتی رایتل,,1
طرح تشویقی مکالمه رایگان ایرانسل,,1
شارژ رایگان ایرانسل و همراه اول,,1
بانک پارسیان,,3
نحوه انتقال شارژ همراه اول,,1
صورتحساب همراه اول,,2
دانلود برنامه ی ایرانسل من,,1
کد لغو جزیره هوشمند ایرانسل,,2
دانلود برنامه ایرانسل من,,1
برنامه ایرانسل من,,1
بسته های اینترنت ایرانسل نامحدود,,1
لغو جزیره ایرانسل,,2
غیر فعال سازی تبلیغات ایرانسل,,2
کد حذف پیامهای تبلیغاتی ایرانسل,,2
مودم همراه ایرانسل,,1
usim همراه اول,,1
خبرآنلاین,,3
طرح مکالمه ویژه همراه اول,,1
طرح مكالمه رايگان همراه اول,,1
طرح ویژه همراه اول,,1
طرح گلچین همراه اول,,1
کد یک روز مکالمه رایگان همراه اول,,1
طرح مکالمه همراه اول,,1
دریافت صورت حساب همراه اول,,1
طرح هدف همراه اول,,1
طرح زمستانی ایرانسل,,1
سوشا مکانی,,3
طریقه تعویض آهنگ پیشواز ایرانسل,,1
طرح قرمز ایرانسل,,1
شماره تماس ایرانسل,,2
ایرانسل من اندروید,,1
کد آهنگ پیشواز ایرانسل محسن چاوشی,,1
کد های ایرانسل,,1
فرارو,,3
رویت صورت حساب همراه اول,,1
غیر فعال سازی تبلیغات همراه اول,,2
دریافت قبض موبایل همراه اول,,2
کد بسته اینترنتی همراه اول,,1
قبض تلفن همراه,,2
عدم دریافت پیامک تبلیغاتی همراه اول,,2
آهنگ انتظار همراه اول,,1
فعال كردن اينترنت همراه اول دائمي,,1
قطع اس ام اس تبلیغاتی همراه اول,,2
اطلاع از شارژ همراه اول,,1
طرح های ایرانسل برای تماس,,1
کد بسته های اینترنتی ایرانسل,,1
لغو پیامهای تبلیغاتی ایرانسل,,2
کد فعال سازی مکالمه نامحدود ایرانسل,,1
کد آهنگ پیشواز ایرانسل شاد,,1
بسته مکالمه ایرانسل,,1
sim.irancell.ir,,1
طرح شگفت انگیز ایرانسل,,1
طرح مکالمه ایرانسل,,1
کد مکالمه نامحدود ایرانسل,,1
رایتل,,1
فعال كردن رومينگ همراه اول,,1
صفحه اصلی همراه اول,,1
بسته مکالمه نامحدود همراه اول,,1
لغو پیام های تبلیغاتی همراه اول,,2
قطع پیامک تبلیغاتی در همراه اول,,2
تعبیر خواب,,3
لغو پیامک های همراه اول,,2
ایرانسل در عراق,,1
لغو پیامکهای تبلیغاتی ایرانسل,,2
بانک شهر,,3
مناطق تحت پوشش 4g ایرانسل,,1
کد جایگزینی آهنگ پیشواز ایرانسل,,1
طرح مکالمه نامحدود ایرانسل,,1
شماره طلایی ایرانسل,,1
نحوه فعال سازی اینترنت ایرانسل,,1
بانک صادرات,,3
حذف پیام تبلیغاتی ایرانسل,,2
غیر فعال سازی پیامهای تبلیغاتی ایرانسل,,2
تنظیمات 4g ایرانسل,,1
آهنگ پیشواز همراه اول محمود کریمی,,1
کد مکالمه نامحدود همراه اول,,1
هادی نوروزی,,3
طرح هدف رو بزن همراه اول,,1
مكالمه نامحدود همراه اول,,1
کد تماس رایگان همراه اول,,1
طرح نامحدود همراه اول,,1
طرح مکالمه نامحدود همراه اول,,1
شارژ نامحدود همراه اول,,1
طرح همراه اول برای مکالمه,,1
فال روزانه,,3
مرکز خدمات مشترکین ایرانسل,,1
پیشواز ایرانسل محرمی,,1
کد پیشواز محرمی ایرانسل,,1
کد پیشواز نوحه ایرانسل,,1
نوحه پیشواز ایرانسل,,1
پیشواز ایرانسل مداحی,,1
کد پیشواز ایرانسل کربلا میخوام ابوالفضل,,1
آهنگ پیشواز ایرانسل مداحی,,1
شارژوایمکس ایرانسل,,1
طریقه حذف آهنگ پیشواز ایرانسل,,2
پیگیری سیم کارت هدیه ایرانسل,,1
پورتال توزیع کنندگان ایرانسل,,1
شارژ وایمکس ایرانسل ecare,,1
ایرانسل بسته,,1
سرویس 3 همراه اول,,1
سرویس 3,,1
سرویس ۳ همراه اول,,1
سرویس 3 همراه اول چیست,,1
سرویس3 همراه اول,,1
service3,,1
اتو شارژ مستقیم همراه اول,,1
service3.ir,,1
سرویس 3g همراه اول,,1
چگونگی فعال سازی اینترنت همراه اول,,1
آوای انتظار همراه اول بی کلام,,1
نحوه ارسال شارژ همراه اول,,1
هدیه ویژه ایرانسل,,1
کد لغو پیامهای تبلیغاتی ایرانسل,,2
کنترل حساب وایمکس ایرانسل e care,,1
طرح های اینترنتی ایرانسل,,1
خرید سیم کارت ایرانسل با شماره دلخواه,,1
سایت رایتل,,1
کنترل حساب ایرانسل,,2
آهنگ پیشواز ایرانسل مهدی احمدوند,,1
سالگرد همراه اول,,1
تعرفه رومینگ همراه اول,,1
کلوب,,3
قيمت سيم كارت دائمي همراه اول,,1
نقشه تهران,,3
نوترينو همراه اول,,1
تنظیمات apn همراه اول,,1
خرید شماره دلخواه همراه اول,,1
شارژ رایگان همراه اول واقعی,,1
غير فعال كردن اينترنت همراه اول,,2
قبض تلفن همراه اول,,2
طرح 100 برابر ایرانسل,,1
همسریابی,,3
کد تماس رایگان ایرانسل,,1
طرح شارژ رایگان ایرانسل,,1
طرح جدید ایرانسل,,1
شاهد نت,,
تعرفه وایمکس ایرانسل,,1
شارژ اینترنت مخابرات,,1
طرح های تشویقی ایرانسل,,1
shiraztel.co.ir,,
اتوشارژ شارژ همراه اول,,1
فیلم نت همراه اول,,1
انتقال اعتبار همراه اول,,1
یاهو,,3
حذف پيامهاي تبليغاتي همراه اول,,2
نصب اینترنت همراه اول,,1
انتخاب,,
شارژ همراه اول مستقیم,,1
آهنگ جدید,,1
پیشواز همراه اول مرتضی پاشایی,,1
اوای انتظار همراه اول,,1
نوترینو,,1
کد آوای انتظار همراه اول,,1
بسته اينترنت همراه اول,,1
شارژ اینترنتی همراه اول,,1
کد بسته اینترنت همراه اول,,1
کداهنگ پیشواز همراه اول,,1
شرکت همراه اول,,1
صور,,
حذف پیامک همراه اول,,2
طریقه فعال سازی اینترنت ایرانسل,,1
irancell.bamilo,,1
الهام عرب,,2
ایران سل,,1
ایرانسل بامیلو,,1
irancell.bamilo.ir,,1
حذف اس ام اس تبلیغاتی ایرانسل,,2
طرح ویژه ایرانسل,,1
لغو اس ام اس تبلیغاتی ایرانسل,,2
ایران فیلم,,3
لغو پیام های تبلیغاتی ایرانسل,,2
انتقال اعتبار ایرانسل,,1
تعرفه اینترنت همراه اول,,1
مسابقات ایرانسل,,1
بسته های همراه اول اینترنت,,1
كد پيشواز همراه اول,,1
خرید مستقیم شارژ همراه اول,,1
اهنگ پيشواز همراه اول,,1
اینترنت همراه اول 3g,,1
کد آهنگ پیشواز همراه اول جدید,,1
دریافت تنظیمات همراه اول,,1
خرید اینترنتی شارژ همراه اول,,1
كد آهنگ پيشواز همراه اول,,1
پيشواز همراه اول,,1
عکس,,3
همراه اول 3g,,1
نوترینو همراه اول,,1
کدهای همراه اول,,1
کدپیشواز همراه اول,,1
رمز شارژ اینترنت ایرانسل,,1
سوابق بیمه,,3
طرح مکالمه رایگان شبانه ایرانسل,,1
شماره تلفن خانم,,
کد آهنگ پیشواز ایرانسل علی عبدالمالکی,,1
پرتال توزیع کنندگان ایرانسل,,1
تالیا,,1
بیرصدا,,3
کد آهنگ پیشواز ایرانسل خارجی,,1
مسابقات جاری ایرانسل,,1
چت روم ایرانسل,,1
غیرفعال سازی پیامک تبلیغاتی,,2
ثبت نام وام ازدواج,,3
ثبت نام سیم کارت دائمی همراه اول,,1
کد غیرفعال سازی پیامکهای تبلیغاتی همراه اول,,2
www.eatc.ir,,3
اینترنت همراه اول نمایشگاه کتاب,,1
کمپین زمستانی همراه اول,,1
کد روز اینترنت رایگان همراه اول,,1
4g همراه اول,,1
گرفتن شارژ همراه اول,,1
خرید شارژ همراه اول از بانک تجارت,,1
رمز فعال سازی اینترنت ایرانسل,,1
بانک ملی ایران,,3
هدیه بهاری ایرانسل,,1
لیست آهنگ پیشواز ایرانسل,,1
طرح جزیره ایرانسل,,1
اتو شارژ ایرانسل,,1
خرید شارژ ایرانسل بانک تجارت,,1
بانك تجارت,,3
دریافت صورتحساب همراه اول,,2
دریافت قبض همراه اول,,2
خرید شارژ مستقیم ایرانسل,,1
دريافت قبض همراه اول,,2
شارژ مستقیم همراه اول,,1
کتابخوان ایرانسل,,1
قرعه کشی i20 ایرانسل,,1
پیکان جدید,,3
کد پیشواز ایرانسل میثم ابراهیمی,,1
چت روم فارسی,,3
هک اینترنت ایرانسل,,2
قطع اینترنت ایرانسل,,2
پیشوازهای جدید ایرانسل,,1
چگونه اینترنت ایرانسل را فعال کنیم,,1
طرح هدفت رو بزن همراه اول,,1
طريقه فعال كردن اينترنت همراه اول,,1
فعالسازي اينترنت همراه اول,,1
روش فعال كردن اينترنت همراه اول,,1
كد شارژ همراه اول,,1
اینترنت پرسرعت همراه اول,,1
