Query,Score,Suggestion
ایمیل ایرانسل,,1
فهمیدن شماره ایرانسل,,1
کد پیشواز ایرانسل جدید 98,,1
شارژ مخدوش ایرانسل,,2
لوگو ایرانسل,,1
اطلاع از وضعیت بسته اینترنت ایرانسل,,1
کنترل حساب اینترنتی ایرانسل,,1
ورزش 3,,3
filimo,,3
فیلیمو و ایرانسل,,1
کد انتقال شارژ همراه اول به ایرانسل,,1
نصب ایرانسل من بر روی ios,,1
سیمکارت رایگان ایرانسل,,1
پرسپولیس,,3
کد استعلام اینترنت ایرانسل,,1
اضافه اعتبار همراه اول,,1
اضافه اعتبار قابل تخصیص,,1
کد دوشنبه سوری همراه اول تیرماه,,1
بدهی همراه اول به مشترکین,,2
چگونه کد آهنگ پیشواز همراه اول خود را پیدا کنیم,,1
طرح مكالمه همراه اول,,1
شکایت از همراه اول,,2
کد اهنگ پیشواز همراه اول مهراد جم شیک و پیک,,1
دوشنبه سوری,,1
فروش اقساطی سیم کارت دائمی همراه اول,,1
کد اهنگ پیشواز مهراد جم,,1
سامانه گلچین همراه اول,,1
سهامداران همراه اول,,1
اضافه دریافتی همراه اول,,1
کد پیشواز همراه اول مهراد جم,,1
کد لغو تمدید اینترنت همراه اول,,2
میزان شارژ همراه اول,,1
امور سهام همراه اول,,1
hdvhksg,,3
چگونه آهنگ پیشواز ایرانسل را لغو کنیم,,2
پورتال ایرانسل,,1
اینترنت وفاداری ایرانسل,,1
کد شارژ رایگان ایرانسل,,1
کد پیشواز ایرانسل مهراد جم,,1
ارتباط با ایرانسل,,1
نماوا,,3
پیگیری شارژ ایرانسل,,1
انتقال اینترنت ایرانسل,,1
ورزش سه,,3
آهنگ پیشواز همراه اول مهراد جم,,1
هم آوا,,3
فروشگاه همراه اول,,1
کد لغو بسته رزرو همراه اول,,2
خرید شارژ همراه اول مستقیم,,1
سايت همراه اول,,1
لغو تمدید خودکار اینترنت همراه اول,,2
شماره های رند همراه اول,,1
کد اینترنت ساعتی همراه اول,,1
apn همراه اول,,1
پرداخت صورتحساب ایرانسل,,1
خرید اینترنتی سیم کارت ایرانسل,,1
اسیاتک,,3
بسته های پیامکی ایرانسل,,1
سامانه همتا,,
دانلود تلگرام ایکس برای ایرانسل,,1
خرید بسته اینترنت ثابت ایرانسل,,1
کد طرح مکالمه ایرانسل,,1
آهنگ های پیشواز ایرانسل,,1
گرفتن اینترنت ایرانسل,,1
اینترنت نامحدود ایرانسل,,1
باقیمانده شارژ ایرانسل,,1
خدمات محتوایی همراه اول چیست,,1
اعتبار قابل تخصیص همراه اول,,1
لغو بسته اینترنتی همراه اول,,2
باشگاه مشتریان همراه اول,,1
امتیازگیری همراه اول,,1
باشگاه فیروزه ای,,1
نحوه فعالسازی اینترنت همراه اول,,1
کد دستوری تنظیمات اینترنت همراه اول,,1
دانلود آهنگ جدید,,1
بسته مکالمه همراه اول اعتباری,,1
گوش دادن آهنگ پیشواز همراه اول جدید,,1
کد باقیمانده اینترنت همراه اول دائمی,,1
آهنگ پیشواز همراه اول جدید,,1
تقویت کننده آنتن موبایل ایرانسل زیرهمکف,,
طریقه گرفتن شارژ اضطراری ایرانسل,,1
پیگیری مرسولات پستی,,3
هدیه ماه رمضان ایرانسل,,1
خرید شارژ ایرانسل با گوشی,,1
کد دستوری خرید شارژ ایرانسل,,1
تغییر آهنگ پیشواز ایرانسل,,1
استعلام بسته اینترنت ایرانسل,,1
شارز ایرانسل,,1
روش حذف پیشواز ایرانسل,,2
رمز ایرانسل,,1
غير فعال كردن تبليغات همراه اول,,2
دریافت ریز مکالمات همراه اول,,1
بانک پاسارگاد,,3
کد پیشواز همراه اول رضا بهرام,,1
پیشواز همراه اول رضا بهرام,,1
my.mci.ir,,1
ریز مکالمات همراه اول,,1
دریافت ریز قبض همراه اول,,2
دیوار,,3
تماس با همراه اول,,2
قطع پیامک های تبلیغاتی ایرانسل,,2
رمز خط ب خط ایرانسل,,1
ایرانسل من نسخه وب,,1
سوزاندن سیم کارت ایرانسل,,
خرید بسته برای مودم ایرانسل,,1
اهنگ پیشواز جدید ایرانسل,,1
عکس پروفایل,,
سیب اپ,,
کدآهنگ پیشواز ایرانسل,,1
پیشواز ایرانسل جدید,,1
پرداخت ایرانسل,,1
عیدی همراه اول سال 98,,1
عیدانه همراه اول 98,,1
عیدی ایرانسل 98,,1
کد عیدی همراه اول 98,,1
اینترنت نوروزی همراه اول,,1
مخترع تلفن همراه,,
کد عیدی ایرانسل 98,,1
رمز عیدی همراه اول,,1
عیدی همراه اول 1398,,1
هدیه نوروزی همراه اول 98,,1
اینترنت هدیه نوروزی همراه اول,,1
چند عدد اول زوج وجود دارد,,3
کدام حشره دو معده دارد,,3
اولین سال برگزاری کنکور,,3
قلعه اولتان,,3
سيب اپ,,3
عيدي همراه اول ٩٨,,1
عیدی همراه اول 98,,1
تنظیمات همراه اول,,1
عیدانه ایرانسل 98,,1
عیدی ایرانسل سال 98,,1
اینترنت عیدانه ایرانسل,,1
شارژ عیدانه ایرانسل,,1
عیدانه ایرانسل ۹۸,,1
هدیه عیدانه ایرانسل,,1
اینترنت عیدی ایرانسل 98,,1
رمز عیدی ایرانسل,,1
عیدی رایتل 98,,1
شارژ عیدی ایرانسل ۹۸,,1
فروش سیم کارت دائمی همراه اول,,1
اسامی برندگان همراه اول,,1
برندگان همراه اول,,1
دوشنبه های همراه اول,,1
تنظيمات اينترنت همراه اول,,1
یوسیم همراه اول,,1
طرح دوشنبه سوری همراه اول,,1
کد پیشواز همراه اول عالیجناب عشق,,1
روش فعال سازی اینترنت همراه اول,,1
سیم کارت دیتا ایرانسل,,1
بسته های اینترنت ایرانسل ماهانه تمام روز,,1
دانلود سیب اپ,,3
اخبار,,3
دیلیت اکانت تلگرام,,3
حذف پیامک تبلیغاتی ایرانسل 7575,,2
rightel,,1
فعال سازی پیشواز ایرانسل,,1
شماره اپراتور ایرانسل,,1
کد پیشواز ایرانسل مهدی احمدوند,,1
سیم کارت همراه اول از offsim.ir,,1
جزئیات قبض همراه اول,,2
پیشواز فاطمیه همراه اول,,1
پنج دقیقه مکالمه رایگان همراه اول,,1
طرح جدید مکالمه همراه اول,,1
همگام,,3
مودم 4g همراه اول,,1
نحوه اطلاع از شارژ همراه اول,,1
مکالمه نامحدود همراه اول,,1
کد شارژ اضطراری همراه اول,,1
شارژ همراه اول بانک ملی,,1
انتقال شارژ,,1
ناد,,3
بهترین تنظیمات اینترنت ایرانسل,,1
رمز عبور ایرانسل من,,1
شارژ مودم ایرانسل td-lte,,1
ایرانسل لالیگا,,1
مرکز پیام ایرانسل,,1
ایرانسل شاپ,,1
استعدادیابی ایرانسل,,1
www.irancell.ir,,1
شارژ اظطراری ایرانسل,,1
گرفتن شارژ ایرانسل,,1
irancell.ir/myirancell,,1
رمز خط به خط ایرانسل,,1
شارژ,,1
روش وارد كردن شارژ همراه اول,,1
استعلام مانده شارژ همراه اول,,1
کد حذف پیامک پولی همراه اول,,2
كد وارد كردن رمز شارژ همراه اول,,1
خرید اشتراک روزانه فیلیمو همراه اول,,1
سامانه همراه من,,1
ثبت نام کارت سوخت,,3
استعلام خلافی,,3
شارژ رایگان همراه اول جدید,,1
لغو تمدید خودکار بسته همراه اول,,2
مشاهده صورت حساب همراه اول,,1
یوسیم همراه اول چیست,,1
شهرخبر,,3
غير فعال كردن سرويس هاي همراه اول,,2
اینترنت رایگان ایرانسل شب یلدا,,1
اطلاع از مانده بسته اینترنت ایرانسل,,1
volte ایرانسل چیست,,1
هدیه ترابرد به ایرانسل,,1
تنظیمات اینترنت ایرانسل 4g,,1
طرح های مکالمه ایرانسل,,1
شنیدن آهنگ پیشواز ایرانسل,,1
شارژ شگفت انگیز ایرانسل,,1
ترابرد ایرانسل,,2
نمایندگی ایرانسل,,1
سرویس volte همراه اول,,1
سرویس volte همراه اول چیست,,1
خانواده برتر,,3
طراحی پورتال,,3
میموسا,,3
کد آهنگ پیشواز همراه اول جدید غمگین با پخش انلاین,,1
کد شارژ شگفت انگیز همراه اول,,1
طراحی چت روم,,3
صبحانت همراه اول,,1
کارتخوان سیار آیپا,,3
اپلیکیشن همراه من,,1
حذف پیام های تبلیغاتی همراه اول,,2
باشگاه خبرنگاران جوان,,3
لغو سرویسهای همراه اول,,2
سرویس ولتی همراه اول چیست,,1
اینترنت 4g همراه اول,,1
بانک رفاه,,3
استعلام خط همراه اول,,1
لغو سرویس های همراه اول,,2
اطلاع از حجم اینترنت ایرانسل,,1
روش حذف آهنگ پیشواز ایرانسل,,2
www.google.com co,,3
خرید شارژ ایرانسل بانک ملت,,1
شارژ ده برابری ایرانسل,,1
بسته پیامکی ایرانسل,,1
ورود به ایرانسل من,,1
مناطق تحت پوشش ایرانسل,,1
خرید کارت شارژ ایرانسل,,1
تماس رایگان ایرانسل,,1
مشاهده بسته ایرانسل,,1
کد اینترنت رایگان ایرانسل,,1
بسته های مودم ایرانسل,,1
بسته شبانه همراه اول از چه ساعتی شروع میشه,,1
زمان استفاده از اینترنت شبانه همراه اول,,1
طريقه وارد كردن رمز شارژ همراه اول,,1
خرید شارز همراه اول,,1
تماس با اپراتور همراه اول,,2
پرداخت قبض موبایل همراه اول,,1
نحوه خرید بسته اینترنتی همراه اول,,1
رمز دوم همراه اول,,1
حذف پیامهای تبلیغاتی همراه اول,,2
کد دایورت همراه اول,,1
قیمت سیم کارت اعتباری همراه اول,,1
طرح همراه اول,,1
شارژ مستقیم ایرانسل,,1
مانده اینترنت ایرانسل,,1
شارژ اینترنت ایرانسل,,1
آهنگ پیشواز محرم همراه اول با پخش آنلاین,,1
عکس محرم,,3
کد پیشواز همراه اول محمود کریمی,,1
آهنگ پیشواز همراه اول مذهبی,,1
پیشواز همراه اول مذهبی,,1
روش خرید بسته اینترنت همراه اول,,1
طرح فیروزه ای همراه اول,,1
خريد شارژ مستقيم همراه اول,,1
شبانه همراه اول,,1
چگونگی انتقال شارژ ایرانسل,,1
تلفن گویای ایرانسل,,1
دریافت کد آهنگ پیشواز ایرانسل,,1
mobinnet,,1
بانک تجارت,,3
مداحی پیشواز ایرانسل,,1
نرخ ارز,,3
هزینه مکالمه ایرانسل,,1
مقرون به صرفه ترین بسته اینترنت ایرانسل,,1
شارژ اضطراري همراه اول,,1
خط رند همراه اول,,1
رند همراه اول,,1
قبض میان دوره همراه اول,,1
دانگل 3g همراه اول,,1
خرید خط همراه اول,,1
تنظیمات دستی اینترنت همراه اول,,1
کد آهنگ پیشواز همراه اول محسن ابراهیم زاده,,1
خرید شارز ایرانسل,,1
ایرانسل من هک شده,,2
شرایط تبدیل خط اعتباری ایرانسل به دائمی,,1
مزایای تبدیل سیم کارت اعتباری به دائمی ایرانسل,,1
سامانه بام,,3
خدمات دیجیتالی ایرانسل,,1
شارژمستقیم ایرانسل,,1
کد غیر فعال سازی تبلیغات ایرانسل,,2
نحوه انتقال شارژ ایرانسل به ایرانسل,,1
نمایندگی های ایرانسل,,1
5 گیگ اینترنت ایرانسل,,1
دانلود برنامه مای ایرانسل,,1
کد دستوری تنظیمات اینترنت ایرانسل,,1
قیمت خودرو,,3
قیمت مودم همراه ایرانسل,,1
قیمت مودم td lte ایرانسل,,1
قیمت مودم ایرانسل,,1
مودم های ایرانسل,,1
نحوه انتقال شارژ ایرانسل,,1
ساعت اينترنت شبانه همراه اول,,1
بسته های روزانه همراه اول,,1
ساعت شروع اینترنت شبانه همراه اول,,1
بسته روزانه همراه اول,,1
ساعت شبانه همراه اول,,1
اینترنت روزانه همراه اول,,1
ساعت بسته شبانه همراه اول,,1
ساعت شبانه اینترنت همراه اول,,1
اعلام مانده اینترنت همراه اول,,1
زمان بسته شبانه همراه اول,,1
بسته شبانه همراه اول,,1
هدیه شبانه همراه اول,,1
تعرفه های جدید اینترنت ایرانسل,,1
آی سیم ایرانسل,,1
کد غیر فعال سازی پیامک تبلیغاتی ایرانسل,,2
غیر فعال سازی پیامک تبلیغاتی ایرانسل,,2
مانده بسته اینترنت ایرانسل,,1
خریدبسته ایرانسل,,1
بستهای اینترنت ایرانسل,,1
اطلاع از مانده اینترنت ایرانسل,,1
0905 ایرانسل,,1
تعرفه های اینترنت ایرانسل,,1
شماره پشتیبانی ایرانسل,,1
ایرانسل دائمی,,1
شارژ ایرانسل مستقیم,,1
هدیه شبانه همراه اول از چه ساعتی شروع میشه,,1
اینترنت رایگان همراه اول ماه رمضان,,1
۱۲۰گیگ اینترنت همراه اول,,1
کد دستوری خرید شارژ همراه اول,,1
راه اندازی اینترنت همراه اول,,1
استعلام نت همراه اول,,1
فعالسازی اینترنت همراه اول,,1
کد موجودی همراه اول,,1
فعال سازي اينترنت همراه اول,,1
کد لغو اینترنت همراه اول,,2
پرداخت تلفنی قبض همراه اول,,1
شماره امور مشترکین ایرانسل,,1
پخش زنده شبکه 3,,3
سیم کارت nfc ایرانسل,,1
ویترین ایرانسل,,1
پرداخت قبض ایرانسل دائمی,,1
خرید سیم کارت دائمی ایرانسل,,1
جلوگیری از اس ام اس تبلیغاتی ایرانسل,,2
فعالسازی اینترنت ایرانسل,,1
طرح های اینترنت ایرانسل,,1
نحوه گرفتن شارژ اضطراری ایرانسل,,1
تبدیل سیمکارت اعتباری به دائمی ایرانسل,,1
ایرانسل بسته اینترنت,,1
طرح ماه رمضان همراه اول,,1
دریافت شارژ رایگان همراه اول,,1
لغو پیامهای تبلیغاتی همراه اول,,2
استعلام امتیاز همراه اول,,1
انتقال شارژ همراه اول دائمی به اعتباری,,1
آهنگ پیشواز همراه اول بهنام بانی,,1
کد همراه اول برای مکالمه رایگان,,1
کد پیشواز همراه اول محسن ابراهیم زاده,,1
کد شبهای روشن همراه اول,,1
اينترنت شبانه همراه اول,,1
تنظیمات اینترنت ایرانسل برای آیفون,,1
truecaller,,3
ایو,,3
درخواست شارژ اضطراری ایرانسل,,1
شرایط تبدیل سیم کارت اعتباری به دائمی ایرانسل,,1
شرایط تبدیل ایرانسل به دائمی,,1
ایرانسل من برای کامپیوتر,,1
کد پیشواز ایرانسل محسن ابراهیم زاده,,1
تبدیل خط اعتباری به دائمی ایرانسل,,1
رایتل تامین اجتماعی,,1
تبدیل اعتباری به دائمی ایرانسل,,1
صحبت با اپراتور همراه اول,,1
تماس اضطراری همراه اول,,1
اختلال در همراه اول,,2
طرح شبهای روشن همراه اول,,1
طرح جدید همراه اول,,1
تعرفه مکالمه رایگان همراه اول,,1
رمز خرید اینترنت همراه اول,,1
انتقال حجم اینترنت همراه اول,,1
خريد بسته همراه اول,,1
قیمت سیم کارت دائمی ایرانسل,,1
چتر اضطراری ایرانسل,,1
یوبوت,,
فعال سازی شارژ اضطراری ایرانسل,,1
14 گیگ اینترنت رایگان ایرانسل,,1
نرم افزار پوست,,3
نحوه اطلاع از باقیمانده اینترنت ایرانسل,,1
سامانه مدیریت ساختمان اینترنتی کمک پلاس,,3
شماره تماس اپراتور ایرانسل,,2
دانلود نرم افزار لنز ایرانسل,,1
عیدی همراه اول 97,,1
عيدي همراه اول,,1
اینترنت عیدانه همراه اول,,1
کد شارژ عیدی همراه اول,,1
طرح بهاره همراه اول,,1
عیدی همراه اول ۹۷,,1
هدیه عیدانه همراه اول,,1
کد عیدی همراه اول 97,,1
عیدی ایرانسل 97,,1
مدیر عامل همراه اول,,1
ساعات رایگان اینترنت همراه اول,,1
کد اطلاع از بسته اینترنت همراه اول,,1
جوایز همراه اول,,1
شارژ هدیه همراه اول,,1
اینترنت رایگان همراه اول با سایفون,,1
نحوه پرداخت قبض همراه اول,,1
ارتباط با کارشناسان همراه اول,,1
فعال كردن مكالمه رايگان همراه اول,,1
فری نت همراه اول,,1
ثبت نام کارت ملی هوشمند,,3
اوای انتظار همراه اول با پخش,,1
تلفن پشتیبانی همراه اول,,1
خريد بسته اينترنتي همراه اول,,1
لغو تبلیغات همراه اول,,2
نرم افزار تشخیص,,3
شتاب دهنده,,1
skinup,,3
lenz ایرانسل,,1
شارژ مودم ایرانسل 4g,,1
تلویزیون رایگان ایرانسل,,1
دانلود ایرانسل من برای ios,,1
مودم فورجی,,1
دانلود لنز,,1
هاتگرام همراه اول,,1
کد شارژ فوق العاده همراه اول,,1
مدیرعامل همراه اول,,1
شارژ شگفت انگیز همراه اول,,1
رویت صورتحساب همراه اول,,2
کد اعلام مانده اینترنت همراه اول,,1
اهنگ پیشواز همراه اول حمید هیراد,,1
همراه اول پیشواز,,1
استعلام مانده حساب ایرانسل,,1
کد غیرفعال سازی تبلیغات ایرانسل,,2
ایرانسل من برای اندروید,,1
شارز مستقیم ایرانسل,,1
خرید شارژ رایتل,,1
موجودی اینترنت ایرانسل,,1
طرح زمستانه همراه اول,,1
طرح زمستانه اینترنت همراه اول,,1
دلیل قطع شدن اینترنت همراه اول,,2
كد فعال سازي اينترنت همراه اول,,1
دانلود سایفون,,3
وصل تلفن همراه اول قطع شده,,2
خريد بسته هاي اينترنت همراه اول,,1
تلفای همراه اول,,1
کد پیشواز همراه اول حمید هیراد,,1
کد اعلام موجودی همراه اول,,1
کد آهنگ پیشواز همراه اول حمید هیراد,,1
تلفن های همراه اول,,1
لغو اس ام اس تبلیغاتی همراه اول,,2
اینترنت شبانه رایگان همراه اول,,1
غیر فعال سازی اینترنت همراه اول,,2
غیرفعال سازی پیامک تبلیغاتی همراه اول,,2
قبض موبایل همراه اول,,2
چرا اینترنت ایرانسل قطع شده,,2
نرم افزار لنز ایرانسل,,1
قطع شدن اینترنت ایرانسل,,2
طرح شبانه ایرانسل,,1
اتوشارژ ایرانسل,,1
طرح مکالمه شبانه ایرانسل,,1
خرید شارژ ایرانسل بانک ملی,,1
کد فعال سازی اینترنت هدیه ایرانسل,,1
فعال سازی سیم کارت ایرانسل 4g,,1
روش خرید بسته اینترنت ایرانسل,,1
پرداخت قبض ایرانسل,,1
انتقال شارژ ایرانسل به ایرانسل,,1
طرح ایرانسل,,1
تور اپلیکیشن همراه اول,,1
قیمت سیم کارت اعتباری همراه اول 0910,,1
اینترنت نامحدود روزانه همراه اول,,1
خرید شارژ همراه اول با گوشی,,1
دی جی کالا,,
نحوه دریافت تنظیمات اینترنت همراه اول,,1
اینترنت شبانه همراه اول از چه ساعتی است,,1
قیمت بسته های اینترنت همراه اول,,1
خرید شارژ همراه اول با کد ussd,,1
تعرفه های اینترنت همراه اول,,1
فعال سازی هدیه تولد همراه اول,,1
آهنگ پیشواز شاد همراه اول با پخش انلاین,,1
طرح پاییزه همراه اول,,1
5 دقیقه مکالمه رایگان همراه اول,,1
باما,,3
بامیلو,,3
شارژ اینترنتی وایمکس ایرانسل,,1
قطع دائمی پیامک تبلیغاتی ایرانسل,,2
مدیریت حساب ایرانسل,,1
تنظیمات مودم ایرانسل,,1
نحوه خرید بسته اینترنت ایرانسل,,1
اپلیکیشن لنز ایرانسل,,1
خرید اینترنتی شارژ ایرانسل,,1
تنظیمات دستی اینترنت ایرانسل,,1
تعویض مودم ایرانسل,,1
زوم ایرانسل,,1
غیرفعال سازی پیامک ایرانسل,,2
طریقه شارژ ایرانسل,,1
رسانه همراه اول,,1
رسانه اول,,1
کد غیر فعال سازی اینترنت همراه اول,,2
هدیه ترابرد به همراه اول,,1
مزایای ترابرد به همراه اول,,1
بسته شبانه همراه اول ازچه ساعتی شروع میشود,,1
ساعت استفاده از اینترنت شبانه همراه اول,,1
تلویزیون رایگان همراه اول,,1
تماس بان همراه اول هزینه دارد,,2
بسته هاي اينترنت همراه اول,,1
چگونه شارژ همراه اول انتقال دهیم؟,,1
طرح شبانه همراه اول,,1
ساعت اینترنت شبانه همراه اول,,1
تعرفه رومینگ ایرانسل,,1
ایویز,,3
کد بسته مکالمه ایرانسل,,1
نتایج زنده,,1
کد مانده حساب اینترنت ایرانسل,,1
اعلام مانده اینترنت ایرانسل,,1
اخبار ورزشی,,3
محرم,,3
آهنگ پیشواز همراه اول میثم مطیعی,,1
کد پیشواز همراه اول سیب سرخی قدم قدم,,1
اینترنت داخلی رایگان همراه اول,,1
کد حذف پیامک تبلیغاتی همراه اول,,2
کد پیشواز همراه اول بهنام بانی,,1
نمایندگی های همراه اول در تهران,,1
اطلاع از باقیمانده اینترنت همراه اول,,1
کد پیشواز مداحی ایرانسل,,1
آهنگ پیشواز ایرانسل مذهبی,,1
شماره های رند ایرانسل,,1
تبدیل سیم کارت ایرانسل به 4g,,1
نرخ مکالمه ایرانسل,,1
کد انتقال شارژ ایرانسل,,1
طریقه فعال سازی اینترنت همراه اول,,1
غيرفعال كردن پيامهاي تبليغاتي همراه اول,,2
مخابرات قم,,
تعویض سیم کارت همراه اول غیر حضوری,,1
طریقه خرید بسته اینترنتی همراه اول,,1
تعویض سیم کارت همراه اول,,1
"ilvhi h,g",,3
کد شارژ رایگان همراه اول,,1
تقسیط همراه اول,,1
دفتر خدمات ایرانسل در تهران,,1
چگونه پیام های تبلیغاتی ایرانسل را لغو کنیم,,2
کد آهنگ پیشواز ایرانسل ماکان بند,,1
كد شارژ ايرانسل,,1
کد فعال سازی اینترنت رایگان ایرانسل,,1
مودم جدید ایرانسل,,1
استعلام تعداد سیم کارت ایرانسل,,1
نحوه شارژ ایرانسل از طریق گوشی,,1
عدم دریافت پیامک تبلیغاتی ایرانسل,,2
بسته های مکالمه ایرانسل,,1
اپليكيشن همراه اول,,1
کد فعال سازی هدیه تولد همراه اول,,1
كد خريد بسته اينترنتي همراه اول,,1
اول مارکت,,1
تعرفه اينترنت همراه اول,,1
خرید سیم کارت همراه اول با شماره دلخواه,,1
دستور شارژ همراه اول,,1
دفاتر همراه اول,,1
طرح هاي اينترنت همراه اول,,1
رمز بسته اینترنت همراه اول,,1
