Query,Score,Suggestion
ارز دیجیتال,,
رفع مسدودیت سیم کارت ایرانسل,,1
استخدام ایرانسل,,1
کد اهنگ پیشواز ایرانسل مال خود من باش,,1
خرید آنلاین سیم کارت ایرانسل,,1
دانلود لنز ایرانسل,,1
شارژ اضطراری همراه اول,,1
نحوه سوزاندن سیم کارت ایرانسل,,
وایمکس ایرانسل,,1
ثبت نام سیم کارت ایرانسل,,1
کد پیشواز ایرانسل رضا بهرام,,1
پرینت مکالمات ایرانسل,,1
خرید بسته اینترنت,,1
عیدی همراه اول ۱۴۰۰,,1
هدیه نیمه شعبان همراه اول,,1
عیدی همراه اول 1400,,1
عیدانه همراه اول 1400,,1
کد عیدی همراه اول ۱۴۰۰,,1
هدیه همراه اول برای نیمه شعبان,,1
کد هدیه نوروزی همراه اول,,1
هدیه همراه اول نوروز 1400,,1
هدیه عید مبعث همراه اول,,1
نحوه فعال سازی پیشواز همراه اول,,1
هدیه همراه اول برای عید,,1
بسته عیدانه همراه اول ۱۴۰۰,,1
هدیه تولد همراه اول,,1
کارمزد خدمات همراه اول,,1
چگونه بفهمیم چقدر شارژ همراه اول داریم,,1
قبض موبایل همراه اول ثابت,,1
عیدی ایرانسل ۱۴۰۰,,1
هدیه عید ایرانسل,,1
کد عیدانه ایرانسل,,1
عیدانه ایرانسل ۱۴۰۰,,1
کد عیدی ایرانسل ۱۴۰۰,,1
هدیه نیمه شعبان ایرانسل,,1
بسته عیدانه ایرانسل,,1
هدیه ایرانسل برای عید نوروز,,1
شارژ عیدی ایرانسل,,1
هدیه ایرانسل نوروز 1400,,1
هدیه ایرانسل به مناسبت مبعث,,1
کد عیدی ایرانسل 1400,,1
اینترنت رایگان ایرانسل برای عید,,1
کد عیدانه ایرانسل ۱۴۰۰,,1
کد عیدانه ایرانسل 1400,,1
هدیه ایرانسل برای عید نوروز ۱۴۰۰,,1
ورزش ۳,,3
هدیه ایرانسل,,1
اینترنت روز پدر همراه اول,,1
هدیه همراه اول برای روز پدر,,1
رد پا رضا صادقی,,3
کد آهنگ پیشواز همراه اول کردی شاد,,1
چتر اضطراری همراه اول,,1
کد اهنگ پیشواز همراه اول اوات دلتنگی,,1
سایت های داخلی منتخب همراه اول,,1
اینترنت دانشجویی همراه اول,,1
به نام زدن سیم کارت همراه اول,,1
سایت های داخلی همراه اول,,1
خرید بهترین بسته اینترنت همراه اول,,1
کد طرح مکالمه همراه اول,,1
اینترنت رایگان دهه فجر همراه اول,,1
اینترنت دهه فجر همراه اول,,1
نیمه پنهان سینا سرلک,,3
اینترنت هدیه دهه فجر همراه اول,,1
حذف بسته اینترنت همراه اول,,2
طریقه انتقال شارژ همراه اول,,1
اینترنت روز پدر ایرانسل,,1
خرید شارژ ایرانسل بدون مالیات,,1
خرید بهترین بسته اینترنت ایرانسل,,1
هدیه ایرانسل برای دهه فجر,,1
اینترنت ساعتی ایرانسل,,1
خرید بسته ساعتی ایرانسل,,1
هدیه دهه فجر ایرانسل,,1
اینترنت دانشجویی ایرانسل,,1
کد اینترنت رایگان دهه فجر ایرانسل,,1
کد هدیه دهه فجر ایرانسل,,1
اینترنت رایگان دهه فجر ایرانسل,,1
اینترنت هدیه ایرانسل دهه فجر,,1
5 گیگ اینترنت ایرانسل رایگان,,1
به نام زدن سیم کارت ایرانسل,,1
کد اینترنت رایگان ایرانسل به مناسبت دهه فجر,,1
شماره نمایندگی ایرانسل,,1
وب سایت ایرانسل,,1
ترفند بسته های اینترنت ایرانسل,,1
اینترنت داخلی ایرانسل چیست,,1
کد دوشنبه سوری های همراه اول,,1
کد اینترنت دهه فجر همراه اول,,1
بسته اینترنت هدیه دهه فجر همراه اول,,1
کد باقی مانده اینترنت همراه اول,,1
سجام,,3
پرتال همراه اول,,1
سیم کارت رند همراه اول,,1
سایت ایرانسل,,1
کد پیشواز همراه اول دکلمه عاشقانه,,1
قیمت روز خودرو,,3
لغو دایورت همراه اول,,
کد اینترنت دهه فجر ایرانسل,,1
اینترنت رایگان ایرانسل برای دهه فجر,,1
اینترنت رایگان ایرانسل به مناسبت دهه فجر,,1
سیمکارت رایگان رایتل,,1
ثبت نام در سامانه سجام,,3
گوشی موبایل ویرا مدل vira–v5 دو سیمکارت ایرانسل,,
اینترنت هدیه دهه فجر ایرانسل,,1
تلفن شکایات ایرانسل,,2
۱۴ گیگ اینترنت رایگان ایرانسل,,1
کدانتقال شارژ ایرانسل,,1
انتقال مالکیت سیم کارت ایرانسل,,1
100 گیگ اینترنت رایگان ایرانسل,,1
شارژ نت ایرانسل,,1
مودم,,1
ایرانسل خرید بسته,,1
اینترنت رایگان شب یلدا همراه اول,,1
کد اینترنت رایگان شب یلدا همراه اول,,1
اینترنت یلدا همراه اول,,1
هدیه همراه اول برای شب یلدا ۹۹,,1
هدیه شب یلدا همراه اول ۹۹,,1
اینترنت شبانه نامحدود همراه اول,,1
غیر فعال سازی اینترنت دانش آموزی همراه اول,,2
بسته نامحدود همراه اول,,1
هدیه ایرانسل برای شب یلدا ۹۹,,1
کد انتقال حجم اینترنت ایرانسل,,1
طریقه وارد کردن شارژ ایرانسل,,1
فعال سازی volte ایرانسل,,1
بسته نامحدود ایرانسل,,1
بسته شبانه ایرانسل,,1
کد پیشواز مرتضی جعفرزاده ایرانسل,,1
فعال كردن اینترنت ایرانسل,,1
کد بسته نامحدود ایرانسل,,1
تنظیمات apn ایرانسل,,1
نت رایگان ایرانسل,,1
کد های دستوری ایرانسل,,1
ارسال تنظیمات اینترنت همراه اول,,1
کد از دسترس خارج شدن همراه اول,,2
تبدیل سیم کارت همراه اول به 4g,,1
چگونه اینترنت همراه اول را فعال کنیم,,1
تنظیم اینترنت همراه اول,,1
گلچین همراه اول,,1
تنظیمات اینترنت همراه اول سامسونگ,,1
انتقال شارژ از همراه اول به ایرانسل,,1
استعلام موجودی همراه اول,,1
طرح اینترنت همراه اول,,1
کد تنظیمات اینترنت همراه اول,,1
چگونه شاد را رایگان کنیم ایرانسل,,1
فعالسازی اینترنت رایگان شاد در ایرانسل,,1
چگونه بفهمیم شماره ایرانسل مال کیست,,1
بسته های مکالمه همراه اول,,1
کد فعالسازی اینترنت ایرانسل,,1
کد فعال سازی اینترنت ایرانسل,,1
رمز وارد كردن شارژ ایرانسل,,1
هک اینترنت رایگان ایرانسل,,2
مودم مبین نت,,1
دریافت تنظیمات اینترنت ایرانسل,,1
استعلام شارژ ایرانسل,,1
اینترنت مخابرات,,1
رایگان ایرانسل,,1
خرید بسته ایرانسل اینترنت,,1
لغو اهنگ پیشواز در همراه اول,,2
کد فعال سازی اینترنت همراه اول دائمی,,1
کدهای آهنگ پیشواز همراه اول,,1
آهنگ پیشواز دلخواه همراه اول,,1
کداهنگ پیشوازهمراه اول,,1
تست سرعت اینترنت همراه اول,,1
کد خرید بسته اینترنتی همراه اول,,1
آهنگ پیشواز شاد همراه اول,,1
تغییر آهنگ پیشواز همراه اول,,1
بسته های ترکیبی همراه اول,,1
چگونگی انتقال شارژ همراه اول,,1
شماره ایرانسل دختر برای دوستی,,
کیف پول دیجیتال ایرانسل,,1
کیف دیجیتال ایرانسل,,1
اعتبار دیجیتال ایرانسل,,1
کیف دیجیتال ایرانسل چیست,,1
تنظیمات اینترنت ایرانسل گوشی شیائومی,,1
پرداخت قبض موبایل ایرانسل,,1
نمایندگی ایرانسل تهران,,1
ترفند انتقال شارژ همراه اول به ایرانسل,,1
کد لغو آهنگ پیشواز ایرانسل,,2
کداهنگ پیشوازایرانسل,,1
وبسایت ایرانسل,,1
70 گیگ اینترنت رایگان همراه اول 99,,1
کد دستوری غیر فعال سازی رومینگ همراه اول,,2
سیم کارت دانش آموزی,,1
سیم کارت دانش آموزی همراه اول,,1
کد غیرفعال سازی رومینگ همراه اول,,2
قطع رومینگ همراه اول,,2
کد غیر فعال سازی رومینگ همراه اول,,2
رایگان کردن مکالمه همراه اول,,1
غير فعال كردن رومينگ همراه اول,,2
كد غير فعال كردن رومينگ همراه اول,,2
همراه من ios,,1
کد مکالمه رایگان روزانه همراه اول,,1
دفتر خدمات همراه اول,,1
قبض تلفن ثابت,,
همراه اول بسته اینترنت,,1
سیم کارت رایگان دانش آموزی ایرانسل,,1
نحوه غیر فعال سازی رومینگ ایرانسل,,2
سیمکارت دانش آموزی ایرانسل,,1
آهنگ نیستش قابل دسترس مثل خط ایرانسل,,
کد استعلام بسته اینترنت ایرانسل,,1
کد دستوری غیر فعال سازی رومینگ ایرانسل,,2
غیر فعال سازی رومینگ ایرانسل,,2
کد لغو رومینگ ایرانسل,,2
غیر فعال کردن رومینگ ایرانسل,,2
اطلاع از باقیمانده اینترنت ایرانسل,,1
خرید ایرانسل,,1
عیدی همراه اول عید غدیر,,1
اهنگ محرم,,1
کد پیشواز مداحی همراه اول پخش آنلاین,,1
سازمان سنجش,,3
فعال كردن تماس از دست رفته همراه اول,,1
سایت همراه اول برای خرید اینترنت,,1
سایت رسمی همراه اول,,1
سایت همراه اول,,1
اینترنت رایگان ایرانسل عید غدیر,,1
هدیه ایرانسل به مناسبت عید غدیر,,1
کد پیشواز ایرانسل محرم,,1
کد اینترنت رایگان ایرانسل به مناسبت عید غدیر,,1
پیشواز ایرانسل محرم,,1
عیدی ایرانسل به مناسبت عید غدیر,,1
سایت ایرانسل خرید اینترنت,,1
سایت ایرانسل خرید بسته اینترنت,,1
کد فعال سازی آهنگ پیشواز ایرانسل,,1
نحوه خرید بسته اینترنتی ایرانسل,,1
کد لغو پیشواز ایرانسل,,2
سایت رسمی ایرانسل,,1
سایت اینترنت ایرانسل,,1
ایرانسل مودم,,1
ایرانسل رایگان,,1
قیمت دلار امروز,,3
بسته های بلند مدت همراه اول,,1
بسته بلند مدت همراه اول,,1
کد های خرید اینترنت همراه اول,,1
بسته یکساله همراه اول,,1
بسته سه ماهه همراه اول,,1
پيدا كردن كد آهنگ پيشواز همراه اول,,1
shop.mci.ir,,1
کد بسته های اینترنت همراه اول,,1
خرید بسته های اینترنت همراه اول,,1
بسته های اینترنتی همراه اول,,1
کد بسته همراه اول,,1
خرید بسته بلند مدت ایرانسل,,1
کد دستوری خرید بسته اینترنت ایرانسل,,1
ایرانسل دات آی آر,,1
اینترنت بلند مدت ایرانسل,,1
بسته های بلند مدت ایرانسل,,1
بسته بلند مدت ایرانسل,,1
بسته سالانه ایرانسل,,1
بسته های ماهانه ایرانسل,,1
بسته های اینترنت ایرانسل ماهانه,,1
خرید بسته اینترنت همراه ایرانسل,,1
سایت ایرانسل اینترنت,,1
بهترین بسته اینترنت ایرانسل,,1
خرید بسته ی اینترنت ایرانسل,,1
بسته های ارزان اینترنت ایرانسل,,1
بسته اینترنت همراه ایرانسل,,1
خرید بسته های ایرانسل,,1
خرید بسته های اینترنت ایرانسل,,1
کد ایرانسل اینترنت,,1
اینترنت بین الملل همراه اول چیست,,1
دوشنبه سوری همراه اول چیست,,1
شماره پاسخگویی همراه اول,,1
سیم کارت جوانان همراه اول,,1
آواي انتظار همراه اول,,1
مفید آنلاین,,3
فعال كردن اينترنت خط همراه اول,,1
کد پیشواز همراه اول عاشقانه,,1
نحوه دریافت تنظیمات اینترنت ایرانسل,,1
کد خرید بسته اینترنت ایرانسل,,1
گفتگوی آنلاین ایرانسل,,1
کد خرید بسته ایرانسل,,1
کد خرید اینترنت ایرانسل,,1
کد بسته اینترنت ایرانسل,,1
باقیمانده حجم اینترنت مودم ایرانسل,,1
بسته های پیشنهادی ایرانسل,,1
قبض دائمی ایرانسل,,2
سیم کارت اولی ایرانسل,,1
کد بسته ایرانسل,,1
ثبت نام سایپا,,3
طرح مکالمه رایگان همراه اول اعتباری,,1
سامانه سهام عدالت,,3
سامانه سجام,,3
پیگیری سیم کارت رایگان همراه اول,,1
نحوه فعالسازی سیم کارت همراه اول,,1
تلفن گویای همراه اول,,1
پیگیری سیم کارت رایگان,,1
فعال سازی سیم کارت رایگان همراه اول,,1
قیمت سهام همراه اول,,1
پیگیری خرید سیم کارت همراه اول,,1
پیگیری سیم کارت همراه اول,,1
فعال سازی سیم کارت همراه اول,,1
ثبت نام سجام,,3
بسته های مقرون به صرفه همراه اول,,1
http //i3l.ir/iqftx ارسال رایگان و از طریق پست خواهد بود. روی نبض سلامتی با ایرانسل,,
ثبت نام خودرو,,3
دانلود ایرانسل من برای ایفون از اپ استور,,1
ثبت نام سهام عدالت,,3
لنز,,
دانلود برنامه لنز ایرانسل,,1
کد دایورت ایرانسل,,
چارخونه ایرانسل,,1
کد موجودی اینترنت ایرانسل,,1
بانک ملی,,3
برنامه لنز ایرانسل,,1
ثبت نام سیمکارت همراه اول,,1
ثبت نام رایگان سیم کارت ایرانسل,,1
ثبت نام سیم کارت رایگان,,1
سایت ثبت نام سیم کارت همراه اول,,1
ثبت نام سیم کارت همراه اول سرپرست خانوار,,1
ثبت نام وام یک میلیونی,,3
خرید سیمکارت رایگان همراه اول,,1
سیم کارت رایگان همراه اول برای سرپرست خانوار,,1
ثبت نام اینترنتی سیم کارت رایگان همراه اول,,1
فروشگاه ایرانسل,,1
نحوه ثبت نام سیم کارت همراه اول,,1
shop mcir.ir,,1
دریافت سیمکارت رایگان همراه اول,,1
سیم کارت همراه اول سرپرست خانوار,,1
ثبت نام سیم کارت رایگان همراه اول غیر حضوری,,1
خرید سیم کارت همراه اول رایگان,,1
ثبت سیم کارت همراه اول,,1
ثبت نام همراه اول رایگان,,1
فعال سازي سيم كارت همراه اول,,1
shop mci.ir,,1
ثبت نام اینترنتی سیم کارت همراه اول,,1
دریافت سیم کارت رایگان همراه اول,,1
ثبت نام همراه اول,,1
همراه اول خرید سیم کارت,,1
سیم کارت همراه اول اعتباری,,1
کد های همراه اول,,1
کد رایگان همراه اول,,1
نامحدود همراه اول,,1
انتقال شارژ همراه اول به همراه اول,,1
نت همراه اول,,1
شارژ اینترنت همراه اول,,1
بسته اینترنتی همراه اول,,1
رمز شارژ همراه اول,,1
ثبت نام سیم کارت رایگان همراه اول,,1
سیم کارت رایگان رایتل,,1
سیمکارت ایرانسل سرپرست خانوار,,1
ثبت نام اینترنتی سیم کارت ایرانسل,,1
تغییر نام سیم کارت ایرانسل,,1
استعلام مالکیت سیم کارت ایرانسل,,1
shop irancell,,1
ثبت نام سیم کارت ایرانسل رایگان,,1
ثبت نام سیم کارت همراه اول,,1
کد استعلام سیم کارتهای ایرانسل,,1
فعال كردن سيم كارت جدید ايرانسل,,1
shop.irancell,,1
ثبت نام ایرانسل رایگان,,1
ثبت سیم کارت ایرانسل,,1
سیم کارت رایگان همراه اول,,1
ثبت نام سیمکارت رایگان ایرانسل,,1
دریافت سیم کارت رایگان ایرانسل,,1
استعلام شماره سیم کارت ایرانسل,,1
ثبت نام ایرانسل,,1
سایت خرید سیم کارت ایرانسل,,1
خرید سیم کارت رایگان ایرانسل,,1
سیم کارت ایرانسل رایگان,,1
سیمکارت ایرانسل,,1
خرید سیم کارت ایرانسل,,1
عیدی همراه اول ۹۹,,1
اینترنت ۱۰۰ گیگ همراه اول,,1
۱۰۰ گیگ اینترنت رایگان همراه اول,,1
۱۰۰ گیگ اینترنت رایگان,,1
کد عیدی همراه اول ۹۹,,1
هدیه همراه اول ۹۹,,1
100 گیگ اینترنت رایگان همراه اول,,1
عیدی همراه اول سال ۹۹,,1
عیدانه همراه اول ۹۹,,1
صد گیگ اینترنت رایگان همراه اول,,1
عیدانه همراه اول 99,,1
کد عیدی همراه اول 99,,1
عیدی سال 99 همراه اول,,1
۱۰۰گیگ اینترنت رایگان همراه اول,,1
عیدی ایرانسل ۹۹,,1
عیدی سال 99,,
کد اینترنت عیدی همراه اول,,1
کد اینترنت رایگان همراه اول 99,,1
اینترنت همراه اول رایگان,,1
۱۰۰ گیگ اینترنت رایگان ایرانسل,,1
بسته ۱۰۰ گیگ اینترنت ثابت رایگان ایرانسل,,1
صد گیگ اینترنت ایرانسل,,1
صد گیگ اینترنت رایگان ایرانسل,,1
۱۰۰گیگ اینترنت رایگان ایرانسل,,1
۱۰۰گیگ اینترنت رایگان,,1
کد عیدی ایرانسل 99,,1
20 گیگ اینترنت رایگان ایرانسل,,1
نحوه فعال سازی اینترنت رایگان ایرانسل,,1
100 گیگ اینترنت ایرانسل,,1
۱۰۰ گیگ اینترنت ایرانسل,,1
چگونه 100 گیگ اینترنت رایگان بگیریم,,1
100 گیگ اینترنت رایگان,,1
گیگ اینترنت رایگان ایرانسل,,1
کد اوای انتظار مادر,,1
دائمي كردن خط اعتباري همراه اول,,1
مشاهده ریز صورتحساب همراه اول,,2
افزایش سرعت اینترنت همراه اول,,1
کد پیشواز همراه اول از آرون افشار,,1
تقسیط بدهی همراه اول,,1
شماره امور مشترکین همراه اول,,1
شارز همراه اول,,1
انتقال شارژ همراه اول به شخص دیگر,,1
ایران جیب,,3
طرز انتقال شارژ همراه اول,,1
پشتیبانی همراه اول,,1
خرید بسته مکالمه همراه اول,,1
شماره مرکز پیام ایرانسل,,1
بسته بین المللی ایرانسل چیست,,1
دانا ایرانسل,,1
کدهای اینترنت رایگان ایرانسل,,1
اینترنت بین الملل ایرانسل چیست,,1
50 گیگ اینترنت رایگان ایرانسل,,1
شماره خدمات ایرانسل,,1
ایرانسل من برای ios,,1
تعرفه اینترنت ایرانسل,,1
کد موجودی ایرانسل,,1
خرید رمز شارژ ایرانسل,,1
آوای انتظار,,1
سردار سلیمانی,,
آهنگ پیشواز سردار سلیمانی ایرانسل,,1
آهنگ پیشواز سردار سلیمانی,,1
کد اینترنت رایگان ایرانسل 98,,1
پیشواز قاسم سلیمانی,,1
چگونه شارژ ایرانسل بخریم,,1
تنظیم اینترنت ایرانسل,,1
آوای انتظار ایرانسل,,1
کد انتقال شارژ ایرانسل به ایرانسل,,1
کد مکالمه ایرانسل,,1
انتقال شارژ ایرانسل خط به خط,,1
تست سرعت ایرانسل,,1
کد انتقال شارژ همراه اول,,1
انتقال شارژ همراه اول به ایرانسل,,1
بسته جبرانی همراه اول,,1
اینترنت هدیه شب یلدا همراه اول,,1
طریقه انتقال شارژ همراه اول به همراه اول,,1
www.mci.ir,,1
کد هدیه اینترنت همراه اول,,1
هدیه اینترنت همراه اول,,1
بانک ملت,,3
همراه مکانیک,,1
فیلیمو همراه اول,,1
قیمت سیم کارت دائمی همراه اول,,1
بسته جبرانی ایرانسل,,1
اینترنت جبرانی ایرانسل,,1
کد دریافت اینترنت هدیه ایرانسل,,1
ورود به اپلیکیشن ایرانسل من,,1
خرید سیم کارت رایتل,,1
چرا سرعت اینترنت ایرانسل کم شده,,2
شب یلدا,,1
کدهای دستوری ایرانسل,,1
پرطرفدارترین آهنگ پیشواز ایرانسل,,1
چگونه باقیمانده اینترنت ایرانسل,,1
کد اینترنت هدیه ایرانسل,,1
وب ایرانسل من,,1
نت همراه اول کی وصل میشه,,1
وصل اینترنت همراه اول,,1
وصل شدن اینترنت همراه اول,,1
قطع اینترنت همراه اول,,2
باشگاه فیروزه ایی همراه اول,,1
مخابرات تهران,,
باشگاه فیروزه ای مشتریان همراه اول,,1
فروش اقساطی سیم کارت همراه اول 0912,,1
کد شنیدن پیشواز همراه اول,,1
فال حافظ,,3
گوگل,,3
پرداخت قبض,,3
تلفن همراه اول,,1
اينترنت همراه اول,,1
دانلود آهنگ پیشواز همراه اول,,1
آهنگ پیشواز جدید همراه اول,,1
سیم کارت دائمی همراه اول,,1
آهنگ های پیشواز همراه اول,,1
کد پیشواز همراه اول غمگین,,1
مخابرات,,3
آهنگ پیشواز همراه اول غمگین,,1
آهنگ پیشواز همراه اول رضا بهرام,,1
کد دستوری اینترنت همراه اول,,1
اینترنت ایرانسل کی وصل میشه,,2
زمان وصل شدن اینترنت ایرانسل,,2
گفتگو انلاین ایرانسل,,1
وصل شدن اینترنت ایرانسل,,2
اینترنت ایرانسل وصل,,2
نت ایرانسل کی وصل میشه,,2
تماس از دست رفته ایرانسل,,2
192.168.l.l,,3
کد هدیه اینترنت ایرانسل,,1
خبر,,3
کد آهنگ پیشواز ایرانسل غمگین,,1
کدهای اینترنت ایرانسل,,1
قیمت مودم جیبی ایرانسل,,1
راه اندازی اینترنت ایرانسل,,1
کد دستوری شارژ ایرانسل,,1
کد تبدیل سیم کارت همراه اول به 4g,,1
اینترنت همراه اول در عراق,,1
قبض برق,,3
کد پیشواز همراه اول شهاب مظفری ستایش,,1
خرید بسته اینترنت رومینگ همراه اول,,1
خرید شارژ همراه اول بانک ملت,,1
کد اهنگ پیشواز همراه اول شهاب مظفری ستایش,,1
نرخ مکالمه همراه اول,,1
کد پیشواز ستایش ۳,,1
هزینه رومینگ همراه اول,,1
هزینه مکالمه همراه اول,,1
تعرفه مکالمه ایرانسل,,1
نحوه فعال سازی رومینگ ایرانسل در عراق,,1
دانلود مستقيم ايرانسل من براي ايفون,,1
ایرانسل اربعین,,1
اینترنت ایرانسل در عراق,,1
های وب,,
راه اندازی سیم کارت ایرانسل,,1
مسدود كردن سيم كارت همراه اول,,
کد پیشواز همراه اول من یه نوکر دربه درم,,1
شنیدن آوای انتظار همراه اول,,1
بهترین اهنگ پیشواز همراه اول با پخش انلاین,,1
خرید شارژ همراه اول با رمز دوم کارت,,1
خلافی خودرو,,3
کد تولد همراه اول,,1
خريد سيم كارت همراه اول,,1
تبدیل اعتباری به دائمی همراه اول,,1
تبدیل سیم کارت اعتباری همراه اول به دائمی,,1
ارتباط با اپراتور ایرانسل,,1
پخش زنده شبکه سه,,3
فیدیبو ایرانسل,,1
فیلیمو با ایرانسل,,1
دانلود فیلیمو ایرانسل,,1
هزینه رومینگ ایرانسل,,1
کد اهنگ پیشواز ایرانسل مداحی با پخش انلاین,,1
پرداخت قبض موبایل,,1
فیلیمو برای ایرانسل,,1
